id,name,area,experience,key_skills,description
128559704,Аналитик баз данных/Data Analyst,Казань,От 1 года до 3 лет,,"ЭвоКом предоставляет сотрудникам возможность полностью раскрыть свой потенциал в условиях культуры победителей, где в основе мотивации лежат целеустремленность и желание достичь поставленных целей. Наделяя полномочиями и предлагая карьерные возможности, а также предоставляя конструктивную обратную связь, компания стремится вдохновлять и вовлекать сотрудников в процесс. Мы считаем мотивацию, вклад в реализацию общих приоритетов ЭвоКом и командную работу незаменимыми слагающими успеха. Сегодня компания ЭвоКом рассматривает кандидатов на позицию Аналитик баз данных (удаленно) Основные обязанности:  Оптимизация и настройка SQL-запросов для повышения производительности баз данных Мониторинг и администрирование базы данных для обеспечения их стабильной работы Обеспечение качества и целостности данных через регулярные проверки и валидацию Участие в интеграции данных из различных источников и систем Разработка и внедрение модели машинного обучения (ML) для анализа данных и прогнозирования Внедрение и адаптация инструментов искусственного интеллекта (AI) для улучшения анализа данных Разработка и поддержка OLAP-кубов и BI-решений для углубленного анализа данных Анализ данных и создание отчетов для поддержки бизнес-решений Поддержка пользователей и консультирование по вопросам работы с базами данных и BI-инструментами Разработка и поддержка документации по структуре и процессам баз данных Анализ трендов и возможностей для внедрения новых технологий в области баз данных  Основные требования:  Опыт работы от 3 лет в области анализа данных и бизнес-аналитики Навыки оптимизации SQL-запросов и администрирования баз данных (MSSQL) Навыки работа с Excel (включая Power Query) Навыки программирования на Python (pandas, numpy, matplotlib, SQLAlchemy), разработки API (FastAPI) Навыки построения и сопровождения OLAP-кубов, работа с SSAS Навыки визуализации данных и создания дашбордов в BI-системах (Power BI, Tableau) Навыки внедрения моделей машинного обучения и использования LLM/AI-инструментов Навыки интеграции данных, участие в ETL-процессах Навыки подготовка технической документации Опыт взаимодействия с пользователями и бизнес-командами Знание принципов проектирования и нормализации реляционных БД Знание архитектуры Microsoft SQL Server и компонентов (вкл. SSAS) Знание методов обеспечения качества данных и валидации Знание основ машинного обучения, аналитических моделей и их применения Знания в области хранилищ данных, OLAP-моделирования Знание возможностей и применения LLM и AI в аналитике Знание BI-инструментов и подходов к визуализации  Успешному кандидату мы рады предложить:​​​​​​​​​​​​​​   Возможность работать удаленно   Возможности профессионального и карьерного роста, обучение и развитие   Конкурентоспособная заработная плата   Участие в бонусной схеме в соответствии с корпоративной политикой   Добровольное медицинское страхование, страхование жизни, страхование путешественников   Компенсация питания   Компенсация фитнеса   Выдача продукции компании   Обеспечение орг техникой (корпоративный ноутбук + периферия, мобильный телефон с SIM)"
128544099,Data Scientist,Москва,От 1 года до 3 лет,"Python, SQL, Анализ данных","Предстоящие задачи →  Заниматься построением и поддержкой скоринговых моделей, самостоятельно строить ML-модели (логистическая регрессия, градиентный бустинг, деревья решений) для прогноза дефолтов; Тестировать эффективность риск-правил через эксперименты – оценивать, как изменения повлияют на долю дефолтов и отсечение надежных клиентов; Определять оптимальные пороговые значения (cut-off) для моделей; Составлять рекомендации для разработки новых продуктов и услуг на основании анализа текущего и будущего потребления клиентов; Осуществлять мониторинг и развитие логики системы принятия решения; Реализовать систему автоматизированного дообучения моделей    Для нас важно →  Владение Python и основными библиотеками анализа данных; Знание SQL (оконные функции, оптимизация запросов) и навыки работы с базами данных; Опыт работы с Git, ML Flow, Airflow; Тюнинг существующих моделей, а также построение новых решений с нуля; полная поддержка своих моделей: от написания запроса для выгрузки обучающей выборки из хранилищ данных до анализа результатов A/B-экспериментов и переключения системы принятия решения на новый функционал; Опыт реализации не менее 2-3 проектов по машинному обучению и/или предиктивной аналитике;  + Будет плюсом владение ключевыми метриками розничных рисков, включая воронку одобрения, уровень NPL и вероятность дефолта (PD)   Условия →  Заплатим сколько попросишь, если в ходе собеса поймём, что твои ценности и навыки согласуются с нашим видением Формат работы удаленный, можешь работать с любой точки Трудоустройство возможно как самозанятый или как ип Все в команде равны, каждый имеет свой голос в коллективном обсуждении задач и реализации новых идей Мы легкие на подъем вайбовые ребята, готовые всегда тебе помочь — присоединяйся)"
128542940,Junior Data Analyst (Автоматизация складов),Москва,Нет опыта,"SQL, Jupyter Notebook, A/B тесты","Объединённая компания Wildberries и Russ — это международная технологическая компания, образованная в результате слияния двух лидеров рынка — IT-компании Wildberries и оператора наружной рекламы Russ.Ищем Junior Data Analyst для поддержки аналитических процессов в департаменте автоматизации. Основная задача — помощь в регулярной аналитике и отчётности, сбор и подготовка данных, поддержка SQL-запросов и Excel-отчётов. Роль направлена на разгрузку текущих аналитиков среднего уровня и обеспечение стабильного обновления данных для заказчиков внутри автоматизации.Вам предстоит:  Подготовка и обновление регулярных отчётов по процессам (в Excel, SQL); Выполнение SQL-запросов в ClickHouse по шаблонам и под конкретные аналитические запросы; Очистка, объединение и валидация данных из разных источников; Проверка корректности данных и поддержание качества витрин; Поддержка и развитие текущих аналитических таблиц и дашбордов; Помощь в сборе данных для моделей и аналитических гипотез (SQL Clickhouse/ Python); Формирование коротких аналитических комментариев по результатам выгрузок.  Вы нам подходите, если:    Уверенные базовые знания SQL (SELECT, JOIN, GROUP BY, WHERE, подзапросы); Владение Excel: сводные таблицы, фильтры, формулы, простые визуализации; Понимание принципов анализа данных: метрики, динамика, тренды; Аккуратность и внимательность к цифрам; Умение структурировать информацию и делать краткие выводы.  Будет плюсом:  Опыт работы или обучения с Python (pandas, matplotlib); Базовое представление о Jupyter Notebook; Опыт стажировок / учебных проектов в области аналитики данных; Понимание логистических и операционных процессов маркетплейсов.  Преимущества для сотрудников:   Обучение и развитие: языковые клубы, собственный корпоративный университет, программы развития управленческих навыков и многое другое;   Благополучие сотрудников: корпоративный пакет ДМС со стоматологией, корпоративный спорт, консультации психолога и дополнительные возможности аккредитованной IT-компании;   Множество сообществ: клуб спикеров, футбола, йоги, шахмат и т.д.;   Забота о семьях: создаем условия, в которых легко сочетать карьеру и заботу о близких – от гибкого подхода до масштабных проектов для детей сотрудников;   Скидки и партнерские программы: на обучение, страхование, покупки и многое другое;   Комфортная рабочая среда: бесплатное питание в офисе, современные офисы рядом с метро, корпоративная техника и портал для сотрудников."
128532466,Data Analyst,Москва,От 3 до 6 лет,"SQL, Power BI, Python","Приглашаем Data Analyst в команду Tanks Blitz. Задачи, которые предстоит выполнять:  Проверка данных, выявление и исправление аномалий. Решение небольших, в т.ч. шаблонных задач по различным направлениям (выгрузки ad hoc). Подготовка аналитических записок и презентация результатов. Объекты исследований: аудитория, игровые и монетизационные ивенты, экономика, баланс и др. Разработка и поддержка автоматизированных отчётов (дашбордов) в Fine BI. Планирование и оценка результатов А/Б тестов. Построение предиктивных моделей и калькуляторов.  Мы ожидаем:  Хорошее знание SQL, опыт составления сложных запросов и их оптимизации. Владение различными библиотеками Python для анализа данных. Опыт работы с любыми BI-системами. Отличные коммуникативные навыки и инициативность.  Будет плюсом:  Профильное образование. Опыт работы в игровой индустрии. Богатый пользовательский игровой опыт (особенно в мобильных F2P-играх). Опыт проведения презентаций. Опыт работы с user acquisition.  Что мы предлагаем:  Работу в аккредитованной IT-компании. Расширенный полис ДМС. Доплаты по больничным листам и days off. Тренажёрный зал и душевые в офисе. Компенсацию спорта. Компенсацию питания. Подарки и выплаты сотрудникам на значимые даты (первый день в компании, день рождения, свадьба, рождение детей). Комнаты отдыха с настолками, приставками, игровыми автоматами/столами. Релакс-зоны с массажными креслами Yamaguchi и топовыми кофемашинами. От 500 до 1000 ед. игрового золота на аккаунт в игре ежедневно. Work-life balance: приходим в офис с 9 до 10, уходим с 18 до 19."
128524764,Junior Data Scientist,Москва,От 1 года до 3 лет,"Python, PyTorch, Numpy, pandas, MNE-Python, ЭЭГ, Айтрекинг, обработка сигналов, Машинное обучение, Визуализация данных, Matplotlib, Jupyter Notebook","О проекте:«Нейроллаб» — исследовательская нейромаркетинговая лаборатория, которая изучает реакции пользователей на цифровой контент (реклама, интерфейсы, визуалы) с помощью айтрекинга, биометрии и нейрооборудования. Результаты исследований конвертируются в инсайты и рекомендации для бизнеса. Лаборатория также ведёт научную и образовательную активность (стажировки, проекты). Что предстоит делать:   Предобработка психофизиологических данных (айтрекинг, биометрия, ЭЭГ): очистка, выравнивание, синхронизация потоков данных.   Анализ экспериментальных данных: статистический анализ, извлечение метрик вовлечённости, корреляции, кластеризация, тестирование гипотез.   Объединение и усреднение данных айтрекинга, биометрии и ЭЭГ (скрипты/пайплайны).   Визуализация: тепловые карты взгляда, графики вызванных потенциалов (ERP), временные ряды, агрегированные дашборды и графики для отчётов.   Поддержка и доработка существующих Python-инструментов (рефакторинг, модульность, тесты, документация).   Разработка и прототипирование ML/DL-моделей для распознавания/прогнозирования состояний (по необходимости).   Подготовка отчётной документации и готовых аналитических артефактов для клиентов и внутренней команды.   Проведение технического обучения сотрудников лаборатории по использованию разработанных инструментов.   Участие в научной деятельности: помощь в оформлении методологии, подготовке статей/презентаций (по задачам проекта).   Что мы ждём:   Уверенный Python: numpy, pandas, scipy, matplotlib / plotly.   Опыт работы с PyTorch (или другим DL-фреймворком).   Базовые знания линейной алгебры, математической статистики и цифровой обработки сигналов (DSP).   Опыт работы с сигналами/временными рядами (ЭЭГ, биометрия или аналогичные физиологические данные).   Навыки предобработки и синхронизации мультимодальных потоков данных (айтрекер + биометрия + ЭЭГ).   Опыт визуализации исследовательских данных (групповые и индивидуальные графики, тепловые карты, ERP).   Умение составлять понятную документацию и формировать отчёты для заказчика.   Навыки исследовательской/научной работы (проектирование экспериментов, статистический анализ).   Будет плюсом:   Опыт с библиотеками для ЭЭГ/нейрофизиологии: MNE-python, NeuroKit2 и т.п.   Опыт с R / SPSS.   Опыт работы с системами айтрекинга (Tobii, iMotions и/или их экспорт-форматами).   Опыт создания дашбордов (Dash, Streamlit, Tableau / PowerBI).   Опыт обучения сотрудников и подготовки методических материалов.   Опыт DevOps для моделей (docker, CI/CD) — желателен, но не обязателен.   Опыт работы в научной лаборатории или коммерческих нейро/UX-исследованиях.   Наличие практических проектов (портфолио, GitHub, научные работы, кейсы).   Что мы предлагаем:   Официальное трудоустройство — оформление по ТК РФ в IT - аккредитованную компанию.   Полностью удалённый формат работы.   Частичная занятость: до 20 часов в неделю (возможность совмещения с учёбой/работой при согласованном графике).   Рост и развитие:   Включение в проект с возможностью участия как в коммерческих, так и в научных треках.   Кураторы: руководитель проекта и технический тимлид.   Социальный пакет:   ДМС.   Оплачиваемый отпуск 28 дней в году.   Оплачиваемые больничные."
128542299,Data аналитик (python),Москва,От 1 года до 3 лет,"Анализ данных, Исследовательский анализ данных, Статистический анализ, Python, pandas, Numpy, Внимательность, Data Analysis","Мы - международная технологическая компания, работающая на пересечении данных, математики и инженерии. Участвуем в высокотехнологичных проектах с глобальным охватом. В фокусе - работа с реальными потоками данных, исследовательские задачи, автоматизация и поддержка production-систем. Наша культура - это внимание к качеству, стабильность, высокий уровень профессионализма и технический фокус. Работаем в формате remote-first, но при желании возможна релокация в один из наших хабов спустя год совместной работы. Разыскивается аккуратный, внимательный аналитик с сильными python и pandas. Предстоит быть юнитом поддержки для квантов. Типичные задачи  Работа с данными: найти, проверить на ошибки, правильно обработать. Анализ логов, мониторинг корректности прода. Помощь в точечных исследовательских задачах. Разработка вспомогательных инструментов на python.  Что важно для нас  Уверенное владение python и стремление писать чистый, читаемый код. Опыт работы с pandas и NumPy. Внимание к деталям, аккуратность, системный подход. Желание глубоко разбираться в сложных концепциях и процессах. Высокая мотивация и самостоятельность в решении задач. Опыт в финансах не требуется.  Будет плюсом бэкграунд в математике, инженерии, аналитике или смежных областях.   Что предлагаем  Удалённую работу с гибкой локацией. Доступ к собственному вычислительному кластеру и корпоративной технике. Регулярные офлайн-события и возможность живого общения с командой. Релокация возможна по желанию, не обязательна.  Работу в закрытой, но крайне интересной области с реальными техническими вызовами.  Роль предполагает работу с конфиденциальными данными и технологиями, поэтому предусмотрены строгий NDA и Non-compete-соглашение. Если вас заинтересовала эта роль, просим вас приложить сопроводительное письмо, можно кратко, почему это хороший обоюдный фит."
