id,name,area,experience,key_skills,description
127334738,Middle/Senior Data Scientist,Москва,От 3 до 6 лет,,"Ищем Middle/Senior Data Scientist-ов в Блок «Люди и Культура» со специализацией в решении задач в области ИИ-агентов, LLM, RecSys, NLP, Сlassic ML. Давайте посмотрим примеры задач:  Реализация мультиагентныйх систем (GigaChat + RAG + API), таких как ИИ-рекрутер, работа с обращениями сотрудников и т.д.; Ранжирование резюме/вакансий в задачах подбора; Рекомендации образовательного контента; Распознавание документов и автоматизация рутинных процессов; Прогнозирование оттока и внутренних перемещений; Генерация эмбеддингов; и другие задачи, которые помогают делать HR процессы Сбера лучше.  Какие инструменты мы используем:  Стандартный стек: Python (JupyterLab) + PostgreSQL (GreenPlum).  Обязанности Моделирование:  Анализ с бизнес-заказчиками постановки бизнес-задачи и формализованного описания моделируемого бизнес-процесса, определение входных и выходных параметров, целевых показателей качества разрабатываемой модели, частоты и критериев для переобучения модели при необходимости; Анализ бизнес-задачи и предложение методов моделирования для решения бизнес-задачи; Разработка архитектуры модели и создание прототипа; Вывод модели в промышленную эксплуатацию совместно с командой MLOps; Разработка документации по модели; Сопровождение модели во время промышленной эксплуатации.  Определение потребности и готовности данных:  Подтверждение выполнения требований к данным для перехода к созданию модели; Определение требований к перечню, объему и качеству данных, необходимых для решения бизнес-задачи.  Требования  Опыт работы в области DS от 2х лет; Уверенное программирование на Python и знание SQL; Понимание работы LLM и мультиагентных систем; Знание ML, DL стека Python и ключевых библиотек, numpy, pandas, pytorch, LightGBM; Опыт работы в команде и знание инструментов совместной разработки (git, jira и т.п.); Опыт работы со стеком Big Data (GreenPlum, Hadoop) будет плюсом.  Условия Наша команда – это Data Scientists, Data Analysts, ML Engineers и Data Engineers, которые вместе решают задачи HR с помощью различных методов анализа данных и искусственного интеллекта. Мы — часть DS сообщества банка, которое всегда в курсе всех новинок в машинном обучении и готово ими поделиться.  офис в Москвы, отсутствие дресс-кода; ДМС;    Крупнейшее DS&AI community - более 1200 DS банка, включая:  регулярный обмен знаниями, опытом и лучшими практиками интерактивные лекции и мастер-классы от ведущих ВУЗов и экспертов технологических компаний дайджест о самых последних разработках в области DS&AI и отчеты с крупнейших конференций мира регулярные внутренние митапы"
127363874,Data Scientist/Senior Computer Vision Engineer,Москва,От 3 до 6 лет,,"Aston — аккредитованная аутсорсинговая IT-компания, работающая с 2007 года. Наш штат насчитывает 3400+ специалистов. Мы разрабатываем программное обеспечение и IT-решения в сферах Finance, Healthcare, eCommerce, IoT, Media, Big Data, ML и многом другом.Предлагаем присоединиться в роли Data Scientist!   Заказчик — это ведущий российский ритейлер, который активно развивает онлайн-направление и собственную логистику, сохраняя лидерство в продуктовом ритейле.Почему это будет интересно?    возможность прокачать экспертизу в быстроразвивающейся и насыщенной области; возможность быть частью изменений, улучшений, запусков новых направлений.    Чего мы ждем от специалиста?    опыт работы в роли Data Scientist от 3-х лет; знание Object Detection/Segmentation (поиск лотков, этикеток, швов); знание OCR (распознавание текста/дат на этикетках); знание Image Classification / Anomaly Detection (оценка качества шва, корректности наклейки); опыт работы с видеопотоками (например, RTSP) и их обработкой.    Что мы предлагаем?     Хорошая зарплата: уровень обсуждается индивидуально, есть доплаты за менторство и профактивности.   Развитие: долгосрочные проекты от российских заказчиков, возможность менять направления, прозрачная система Performance Review.   Комфорт и свобода: релокейт между офисами, выбор формата работы (удалённо, офис, гибрид), адаптация для новых сотрудников.   Обучение: доступ к корпоративному порталу, митапам, конференциям (и как гость, и как спикер).   Социальный пакет: ДМС со стоматологией, частичная компенсация спорта, бесплатный английский, оплачиваемый отпуск и больничные.   Корпоративная жизнь: тимбилдинги, детские праздники, внутренние мероприятия.   Наши офисы:   Москва (БЦ “Башня Империя”, 50 этаж),   Санкт-Петербург (Владимирский проспект, д. 23, 8 этаж),   Казань (Н. Ершова, 76/1),   Ростов-на-Дону (Текучева, 246),   Нижний Новгород (ул. Новая, 28, коворкинг ""VMESTE""),   Самара (IT парк Монте Роза).     Откликайтесь, если вы готовы расти и развиваться вместе с командой ASTON! Наш рекрутер свяжется с вами, чтобы обсудить детали."
127348912,"Middle+/Senior Data Scientist (команда ""Платежи и переводы"")",Москва,От 1 года до 3 лет,,"Наша команда занимается разработкой предиктивных моделей и высоконагруженных сервисов для направления Платежи и переводы в транзакционном банкинге. Мы создаём технологии, которые интегрируются в ключевые сценарии мобильного и веб-приложений Сбера, улучшая пользовательский опыт и повышая эффективность финансовых операций. В команде открыта вакансия Middle Data Scientist, которому предстоит работать с огромным объёмом данных экосистемы, разрабатывать и совершенствовать рекомендательные модели. Мы активно развиваем направление, создавая комплексные инновационные решения для клиентов по всей стране. Обязанности  Участвовать в создании и развитии рекомендательной платформы для продуктов для продуктов направления «Платежи и переводы» Анализировать и обрабатывать большие объёмы данных, формировать разметку и признаки для моделирования Разрабатывать и улучшать рекомендательные модели, в основе которых лежат модели ранжирования Писать production-код и внедрять его в промышленную эксплуатацию Проводить A/B-тесты и анализировать результаты для оценки эффективности новых функций и алгоритмов Развивать пайплайны моделирования, проектировать прикладные модули командного фреймворка для повышения эффективности DS-разработки и качества кода  Требования  Глубокое знание классического ML и понимание современных подходов Deep Learning Опыт работы с рекомендательными системами и задачами ранжирования Знание статистики и принципов проведения A/B-тестов Опыт разработки на Python, включая библиотеки pandas, numpy, sklearn, catboost Владение SQL и понимание принципов распределённой обработки данных; опыт работы со Spark Наш стек: Python, Git, PySpark, Hive, Hadoop, hdfs, Catboost, Fastapi, Airflow, Kafka, Openshift, Docker  Условия  Комфортный современный офис рядом с м. Кутузовская Ежегодный пересмотр зарплаты. Годовая премия Корпоративный спортзал и зоны отдыха Более 400 образовательных программ СберУниверситета для профессионального и карьерного развития Программа адаптации и помощь руководителя на старте Расширенный ДМС, льготное страхование для семьи и корпоративная пенсионная программа Гибкий дисконт по ипотечному кредиту, равный 1/3 ключевой ставки ЦБ Бесплатная подписка СберПрайм+, скидки на продукты компаний-партнеров Вознаграждение за рекомендацию друзей в команду Сбера."
127350950,Middle Data Scientist (Команда Цифровой Аватар B2C),Москва,От 3 до 6 лет,,"Наша команда занимается внедрением нейронных сетей в бизнес-процессы банка. Мы строим не только SOTA алгоритмы, но и активно «приземляем» наши исследования, растим бизнес и клиентский опыт, исследуем новые источники данных и подходы к моделированию на них. Тебе предстоит влиться в команду, занимающуюся внедрением больших нейронных сетей в различные бизнес-вертикали Банка. У нас есть много железа, еще больше данных, крутая команда и много амбициозных задач.Обязанности  ML разработка полного цикла - помочь понять что и зачем нужно бизнесу, перевести это в термины ml, подготовить сильное решение и рассказать о нем, выкатить модель в продакшн Искать и прорабатывать гипотезы по улучшению моделей за счет использования новых источников данных Дизайнить системы, планировать пилоты и запускать ручейки для сбора данных Автоматизировать рутину, оборачивая код в читаемые и воспроизводимые пайплайны. Требования  Опыт работы в DS/ML Отличное знание бустингов Отличное знание Pytorch (must, это то, без чего ты не сможешь работать) Английский язык на уровне чтения технической документации.  Будет плюсом:  Хотим найти человека с сильным опытом решения uplift/RL задач, если это ты - сделай акцент в резюме на этом опыте Успех в ML-соревнованиях MLOps стек/навыки (Jenkins/Airflow/Kuber... в дополнение к ML) Опыт с Pyspark/Hadoop. Условия  Комфортный современный офис рядом с м. Кутузовская Формат работы - офис Ежегодный пересмотр зарплаты, годовая премия Корпоративный спортзал и зоны отдыха Более 400 образовательных программ СберУниверситета для профессионального и карьерного развития Расширенный ДМС, льготное страхование для семьи и корпоративная пенсионная программа Гибкий дисконт по ипотечному кредиту, равный 1/3 ключевой ставки ЦБ Бесплатная подписка СберПрайм+, скидки на продукты компаний-партнеров Вознаграждение за рекомендацию друзей в команду Сбера."
127296679,Lead Data Scientist,Санкт-Петербург,От 3 до 6 лет,"Python, SQL, BigQuery, Big Data, Numpy, Deep Learning, MLflow, Apache Airflow, Docker, pandas, SciPy, Matplotlib, TensorFlow, Анализ данных, Алгоритмы и структуры данных","Описание компанииBirmarket — ведущая платформа электронной коммерции Азербайджана, обеспечивающая тысячи клиентов ежедневно удобным и безопасным онлайн-шопингом. Уже более 5 лет мы успешно работаем как крупный маркетплейс (3P-модель), и наша стремительно растущая база клиентов и партнёров укрепляет позиции лидера рынка. Сегодня в команде более 1500 сотрудников, которые каждый день делают онлайн-покупки проще и эффективнее, обеспечивая высокий уровень сервиса.Работа у нас — это возможности профессионального развития, карьерного роста, баланс между работой и личной жизнью, а также комфортные и современные условия труда. Описание ролиМы ищем Lead Data Scientist, который будет руководить разработкой моделей машинного обучения и AI-решений, напрямую влияющих на продукт и клиентский опыт компании.Роль сочетает в себе глубокую техническую экспертизу, лидерство, менторство и кросс-функциональное взаимодействие.Вы будете отвечать за реализацию сложных проектов — от экспериментов до внедрения и мониторинга, а также станете технической опорой для команды дата-сайентистов, продакт-менеджеров и инженеров. Обязанности: • Полная ответственность за проекты машинного обучения — от идеи и прототипа до продакшена и мониторинга;• Техническое руководство командой Data Scientists и ML Engineers;• Разработка и совершенствование моделей для задач ранжирования, рекомендаций, прогнозирования, NLP и других направлений;• Определение и внедрение лучших практик экспериментов, валидации и воспроизводимости;• Наставничество и проведение ревью, развитие специалистов младшего и среднего уровня;• Тесное сотрудничество с командами Product, Engineering и Analytics для согласования решений с бизнес-целями;• Представление результатов и компромиссов как техническим, так и нетехническим стейкхолдерам;• Участие в формировании roadmap по направлению Data Science и определении приоритетных инициатив;• Участие в процессах управления персоналом (найм, продвижение и т.д.). Требования: Обязательные:• 4+ лет опыта в Data Science / Machine Learning, с сильным практическим фоном в моделировании;• Подтверждённый опыт внедрения ML-моделей в продакшн;• Отличное знание Python, SQL и библиотек машинного обучения;• Опыт проведения A/B-тестов, применения статистических методов и оценки бизнес-эффекта;• Глубокое понимание пайплайнов данных, feature engineering и мониторинга моделей;• Превосходные коммуникативные навыки (на азербайджанском и русском языках);• Умение обучать и давать конструктивную техническую обратную связь;• Экспертиза в стрим-направлениях (рекомендательные системы, поиск, маркетинг и др.). Желательные:• Опыт работы в маркетплейсах;• Знание deep learning, графовых моделей или real-time ML;• Опыт работы с ML Ops-инструментами (например, MLflow, Airflow, Docker). Условия:  Современные процессы и сильная продуктовая команда; Возможность развиваться на стыке данных, продукта и технологий; Работа над системами, которые влияют на опыт миллионов пользователей; Оформление: ИП; Покрываем до 10% налогов; Формат работы: гибрид / дистанционная."
127376288,Middle/Senior NLP Data Scientist (Центр компетенций по внедрению ИИ-агентов),Москва,От 3 до 6 лет,,"Центр компетенций по внедрению ИИ-агентов в процессы в Блоке стратегии и развития Сбера – это команда из ex-консультантов с опытом ИТ-трансформаций и продуктовой разработки, ML-инженеров и разработчиков, находящаяся в самом эпицентре масштабной ИИ-трансформации. Сбер не только участвует в мировой гонке разработки больших языковых моделей, но и активно внедряет ИИ-модели/агентов в свои процессы с реальным эффектом для бизнеса. У нашей команды два ключевых направления деятельности:  управление программой внедрения ИИ-агентов в процессы прототипирование (разработка Proof of Concept) решений на базе ИИ-агентов для дальнейшего внедрения в процессы Банка.  Обязанности  разработка агентных и мультиагентных систем на базе LLM совместная с заказчиками проработка вариантов реализации AI-решений участие в согласовании дизайна пилотов и тестов исследования возможностей и сферы применения LLM.  Требования  высшее техническое/математическое образование опыт работы на аналогичной позиции не менее 2-х лет уверенные знания Python уверенное знание теоретической базы ML (основные задачи и методы, метрики, типовые архитектуры моделей и т.д.) и NLP домена (токенизаторы, векторизаторы, transformers, BERT, LLM, RAG и т.д.) опыт разработки ML-решений (в т.ч. анализ данных, построение архитектуры, валидация и т.д.) опыт применения библиотек (pandas, numpy, matplotlib, langgraph/smolagents/pydantic ai или аналогичные библиотеки для построения агентных систем).  Будет плюсом  опыт дообучения LLM (SFT, RL, LoRA и т.д.) опыт работы в доменах Computer Vision (CV), Automatic Speech Recognition (ASR).  Условия  комфортный современный офис рядом с м. Кутузовская формат работы: офис годовая премия корпоративный спортзал и зоны отдыха более 400 образовательных программ СберУниверситета для профессионального и карьерного развития регулярные митапы и развитое DS-community расширенный ДМС, льготное страхование для семьи и корпоративная пенсионная программа гибкий дисконт по ипотечному кредиту, равный 1/3 ключевой ставки ЦБ бесплатная подписка СберПрайм+, скидки на продукты компаний-партнеров вознаграждение за рекомендацию друзей в команду Сбера."
