id,name,area,experience,key_skills,description
127332708,Разработчик Machine Learning (Data Scientist),Москва,От 3 до 6 лет,,"Обязанности: - Разработка и внедрение моделей машинного обучения для оптимизации производственных процессов; - Построение и сопровождение систем предиктивной аналитики; - Прогнозирование спроса и оптимизация производственных планов и продаж под рыночные потребности; - Разработка и поддержка конвейеров обработки данных (ETL/ELT); - Внедрение ML-решений в продакшен с помощью CI/CD, контейнеризации и мониторинга моделей. Требования: - Высшее профильное образование (математика, информатика, прикладная статистика, инженерия данных и т.п.); - опыт: 4+ лет в области Data Science / ML, предпочтительно в агропромышленной отрасли или производственных/ FMCG-компаниях; - конкретные знания, умения, навыки:  Python (pandas, scikit-learn, TensorFlow, Keras), SQL, Tabular ML (XGBoost, LightGBM); ML-ops (MLflow, Airflow, Docker, CI/CD); Работа с временными рядами (Prophet, LSTM), прогнозированием, оптимизацией.  Будет преимуществом:  Computer Vision (OpenCV, PyTorch, YOLO, Detectron2).  Настройка и fine-tuning LLM, опыт работы с RAG-пайплайнами и API крупных моделей. Условия:  - полный рабочий день, с 09ч00 до 18ч00; выходной день: суббота и воскресенье. - офисный или гибридный формат работы (г. Москва, м. Новослободская / м. Менделеевская). - ДМС после испытательного срока."
127353817,Junior Data Analyst в команду антифрода (FinTech),Новосибирск,От 1 года до 3 лет,,"Мы – ведущий российский финтех-провайдер. Наша команда занимается поиском и предотвращением фрода с помощью ML в нескольких направлениях бизнеса компании:- сервис денежных переводов KoronaPay- сервис гашения кредитов Мы работаем по T-shape-подходу: каждый вовлечен во весь цикл — от общения с заказчиком до сопровождения ML-сервисов. В команде работают разносторонние специалисты с разным бекграундом (дата-аналитики, разработчики, эксперты в бизнесе и прикладных областях, системные аналитики, UX/UI-дизайнеры и PM’ы). Мы активно растем и ищем младшего дата-аналитика, готового развиваться вместе с нами. Наши проекты:Мы уже сделали и активно развиваем: несколько антифрод-моделей, сервис деперсонализации логов, сервис проверки по черным спискам На старте тебе предстоит заниматься следующими задачами:- анализировать требований совместно с командой- делать EDA- писать дата-тесты и разбираться в особенностях поставки данных Далее, по мере погружения в проект, наши специалисты подключаются к: - общению с заказчиком и постановке задач- сопровождению inference сервисов на проде- участвовать в R&D, развитии сервисов и MLOps- помогать новичкам Наши процессы: - работаем по Scrum (2-недельные спринты)- каждый сотрудник - человек-оркестр, который может заниматься взаимодействием с заказчиком, сбором данных, обучением модели, написанием инференс сервиса, выносом на прод, сопровождением, мониторингом, MLOps- у каждого новичка есть наставник, онбординг — 2–3 месяца- индивидуальный план развития на 6 месяцев вперед- пересмотр грейда и/или ЗП не реже раза в год Наш стек: - микросервисы на Python + aiohttp / fastapi- библиотеки/фреймворки: SciPy, NumPy, Pandas, Matplotlib, scikit-learn, CatBoost, PyTorch- ML Data management & Experiment tracking: DVC- тестирование данных: SodaCore- оркестрация пайплайнов: Apache Airflow- Big Data tools: Hadoop, Spark, Hive, Impala, HUE, ClickHouse- тестовые и боевые стенды в k8s, Gitlab CI для СI/CD, Helm, Flux- средства мониторинга: Jaeger, Sentry, Grafana, Prometheus- Jira для ведения задач- Confluence для ведения документации Возможные векторы развития для перехода на следующий уровень: - расширение экспертизы в сервисах команды- развитие в MLOps- развитие в R&D (исследования новых подходов etc) Что мы ожидаем: - опыт работы дата-аналитиком/разработчиком от 1 года- знание основ статистики, теории вероятностей и линейной алгебры- умение писать SQL-запросы- знание основ синтаксиса Python, клиент-серверной архитектуры, HTTP, IDE, дебаггер, назначения тестов, общее представление о жизненном цикле разработки- понимание базовых этапов подготовки данных- понимание базовых принципов визуализации и интерпретации данных- знание основных методов валидации моделей и метрики для разных типов задач- понимание базовой структуры ML-проекта (данные → обучение → инференс)- представление, как устроен пайплайн обучения- знание основ CI/CD, логирования, базовые команды shell, git- понимание, как устроен запуск и мониторинг моделей, иметь базовое представление об окружениях, контейнерах и простом деплое Будет преимуществом: - опыт взаимодействия с заказчиком, работы бизнес/системным аналитиком, разработчиком- опыт автоматизации API или веб-приложений- знание, опыт работы с NLP, NN- опыт поставки приложений в промышленный контур- навыки построения аналитических отчётов и дашбордов- владение английским языком, достаточным для чтения технической документации"
127363802,Системный аналитик DWH | Data Steward,Москва,От 3 до 6 лет,,"Чем предстоит заниматься:  Разработка стандартов и ведение документации: единого глоссария данных, дата-каталога, отчётности, алгоритмов и дашбордов. Сбор и анализ бизнес-требований к новым витринам данных и отчетам, проектирование логических моделей. Контроль качества данных: мониторинг метрик, расследование инцидентов и координация их устранения. Описание и формализация бизнес-логики в ТЗ для команд DWH и ETL-разработки. Классификация данных и участие в разработке политик управления данными (Data Governance). Консультирование бизнес-пользователей по вопросам данных и их интерпретации.  Что мы ожидаем от тебя:  Опыт работы в роли системного аналитика или data steward в проектах, связанных с данными. Продвинутый SQL для анализа данных и верификации логики. Понимание принципов моделирования данных, пайплайнов и архитектуры DWH. Понимание полного жизненного цикла данных и основ Data Governance. Опыт написания ТЗ и технической документации. Коммуникативные навыки и умение работать на стыке бизнеса и IT. Внимание к деталям и стремление к порядку.  Что мы предлагаем:   Работа в современной IT-компании.   Возможность реализовать свои идеи и влиять на продукт.   Гибридный или полностью удаленный формат работы.   Оформление по ТК РФ.   Гибкое начало рабочего дня.   Выдаем современное оборудование.   Скидки от партнеров."
127307468,Data analyst / Data scientist,Москва,От 3 до 6 лет,"SQL, Power BI, MS SQL, Математическая статистика, Формирование аналитической отчетности, Python, Регрессионный анализ, Предобработка данных, Основы баз данных, Извлечение данных, Интерпретация данных, Визуализация данных, Исследовательский анализ данных","Rossko - российская компания, основанная в 1997 году. Мы занимаемся производством и дистрибуцией автозапчастей, и у нас работает более 13 000 человек. Мы работаем в России, Казахстане и уже сотрудничаем с Эмиратами. Наши объекты находятся в 114 городах, включая 4 крупных дистрибуционных центра и более 130 магазинов-складов. ИТ-направление – это сердце нашей компании, в котором более 200 специалистов. Мы развиваем и поддерживаем 37 ИТ-продуктов в сфере финансов, логистики, продаж, управление товарными запасами и поддержке станций техобслуживания. У нас 5 дата-центров, более 1000 виртуальных серверов и более 30 Tb оперативной памяти. Для наших ИТ-специалистов мы создали аккредитованное в Минцифры юрлицо ""Блэклайт"", чтобы наши сотрудники получали все льготы ИТ-компаний. Мы расширяем команду отдела логистики и ищем в ИТ команду аналитика Его основная цель - повышать эффективность логистической операционной деятельности за счёт оптимизации транспортных и складских затрат, сокращения времени доставки и повышения прозрачности цепочек поставок. Для этого необходимо обеспечивать бесперебойное движение грузов в нужном объёме, в нужное время и по минимальной стоимости. Достижение этих целей требует анализа текущих инструментов управления логистикой, оценки их эффективности на основе прозрачных метрик, выявления узких мест и внедрения улучшений как в процессы, так и в аналитические инструменты отслеживания и прогнозирования данных.   Инструменты для работы:   Метрики и ключевые показатели выводим на дашборды (powerBI)   Данные для расчетов забираем из БД (MSSQL, PostgreSQL)   Расчеты и моделирование проводим в python (sqlalchemy, pandas, numpy, scipy, sklearn). Также может пригодится statsmodels, prophet и др.   Примеры задач (из текущей повестки):  Скоринг складов и транспортных направлений по ключевым KPI: себестоимость хранения, время обработки заказов, частота задержек, уровень загрузки ТС. Декомпозиция метрики ""стоимость доставки"" до компонент: топливо, логистические посредники, таможенные платежи, простои, расстояние, тип груза и др. Анализ причин простоев на складах или задержек при международных перевозках : выявление паттернов, сезонности, влияния внешних факторов (таможня, погода, регуляторные изменения). EDA по выявлению неэффективных маршрутов или избыточных запасов на складах , определение критериев ""излишка"" в контексте логистики (например, длительное хранение, низкая ротация, высокие издержки хранения).  Предстоит:  Разобраться с текущими алгоритмами и системами , используемыми в логистике: системы планирования маршрутов, WMS, TMS, интеграции с 1С и внешними провайдерами. Понимать, как формируются данные и какие решения принимаются автоматически. Формировать и поддерживать набор метрик эффективности логистических процессов — через регулярные дашборды, ad-hoc отчёты и автоматизированные панели мониторинга.  Разрабатывать и тестировать модели прогнозирования : например, прогноз загрузки складов, времени доставки, потребности в транспорте. Оценивать точность моделей, обосновывать их внедрение. Совместно с продакт-менеджерами и операционными командами предлагать и внедрять улучшения в процессы и инструменты: от прототипа модели до её интеграции в production. Отслеживать эффект от изменений и закрывать цикл обратной связью.  Мы ожидаем:   Вы умеете выявлять факторы влияния на эффективность процессов, проводить факторный анализ.   Имеете опыт регрессионного анализа.   Имеете опыт сегментации и кластеризации.   Имеете опыт прогнозного моделирования, с разным периодом отложенного влияния факторов.   Имеете опыт работы с метриками точности моделей, casual impact, статистическим анализом ab-тестов.   Вы сильны в математической статистике, в т.ч. АБ-тесты.   Имеете опыт анализа временных рядов.   Вы обладаете базовыми знаниями в экономике.   Имеете опыт работы с БД ETL.   Вы умеете определять и декомпозировать метрики эффективности применительно к исследуемым объектам/инструментам/процессам.   Вас ждет: Комфорт:   оклад от 230 000 р. на руки;   удаленный режим работы и гибкий график;   полный онбординг за 3 месяца;   работаем по Kanban, сервис деливери менеджер команды поможет выстроить работу и быстро достичь результата;   старший аналитик данных поможет погрузиться в процессы.   Забота:   соблюдаем баланс жизни и работы, уважаем личные границу, не беспокоим в нерабочее время;   ДМС через полгода работы;   подарки детям на Новый Год;   предоставляем технику для работы при необходимости.   Развитие:   оплачиваем профессиональное обучение, при желании и необходимости;   ценим новые идеи, не страдаем авторитарностью, доверяем профессионалам, которых нанимаем.   А так же:   проводим техническое интервью со старшим аналитиком данных, решения принимаются быстро;   заработная плата “белая”, трудоустраиваем с первого дня;   скидки на автозапчасти и масла до 30%;   есть премирование 30% от месячного оклада 1 раз в квартал, по результатам оценки;   мы не следим за нашими сотрудниками по таймерам, для нас важна атмосфера доверия и результат."
127416103,Аналитик данных (Data аналитик),Москва,От 3 до 6 лет,,"Мы приглашаем присоединиться к команде опытных профессионалов, занимающихся разработкой и исследованием прогностических моделей в сфере страхового и инвестиционного бизнеса. Наша цель — повышение точности и надежности прогнозов посредством внедрения передовых технологий и подходов в анализе данных. Если вы обладаете необходимыми знаниями и опытом, готовы развиваться вместе с нами и вносить вклад в успех финансового сектора, эта позиция станет отличным шансом реализовать ваши амбиции!Обязанности  Разрабатывать и тестировать статистические и машинно-обучаемые модели для прогнозирования рисков и доходностей в страховании и инвестициях; Интегрировать лучшие практики и стандарты в области моделирования, повышая точность и надежность прогнозов; Идентифицировать необходимые данные и собирать их из разных источников внутри группы Сбербанк; Консультировать внутренние подразделения по вопросам поиска, обработки и интерпретации данных; Помогать коллегам выбирать подходящие методы анализа и способы визуализации данных. Требования  Продвинутый уровень владения языком запросов SQL (включая аналитические функции, хранимые процедуры, материализованные представления и производительность); Опыт работы с одной из реляционных баз данных PostgreSQL или MySQL и инструментами Business Intelligence; Уверенное владение Python для анализа больших объемов данных (например, библиотеки pandas, numpy, регулярное выражение, SQLAlchemy/psycopg, PySpark); Высокий уровень развития алгоритмического и аналитического мышления; Наличие опыта составления технических заданий и работы с Jira или аналогичными системами управления проектами; Способность проводить проверку достоверности исследовательских гипотез; Коммуникационные навыки и умение эффективно взаимодействовать с коллегами; Опыт работы с ИИ-инструментами. Условия  Современный комфортный офис в центре Москвы рядом с метро Белорусская; Льготные условия ипотеки от Сбербанка; Бесплатная подписка на сервис премиум-класса СберПрайм+ и скидки на продукцию партнеров: Okko, СберМаркет, МегаФон, Самокат, Еаптека и другие; ДМС с момента трудоустройства и специальные программы страхования для членов семьи сотрудников; Участие в корпоративной пенсионной программе; Организация детского отдыха и предоставление подарков детям сотрудников за счёт компании; Обучение за счёт работодателя: онлайн-курсы, доступ к специализированной литературе, мероприятия Корпоративного Университета, включая тренинги, митапы и возможности профессиональной переподготовки; Специальные скидки на проживание и отдых в курортном комплексе Mriya Resort & SPA в Крыму."
