id,name,area,experience,key_skills,description
128003253,Senior Data Analyst / Ведущий аналитик данных,Москва,От 3 до 6 лет,,"Мы ищем специалиста по работе с клиентами уровня B2 для нашего международного отдела клиентского сервиса. Ваша задача будет заключаться в обеспечении высокого качества обслуживания наших клиентов, оперативном решении их запросов и поддержке в процессе взаимодействия с компанией. Вы станете частью профессиональной команды, которая ориентирована на постоянное улучшение клиентского опыта и развитие долгосрочных отношений с нашими партнерами. Обязанности  Официальное трудоустройство согласно ТК РФ; Конкурентоспособная заработная плата; ДМС после прохождения испытательного срока; Возможность профессионального развития и карьерного роста; Удобный график работы; Современный офис в центре города.  Требования  Высшее образование (желательно в сфере маркетинга, управления или смежных областях); Опыт работы в сфере клиентского сервиса от 2 лет; Знание английского языка на уровне Upper Intermediate и выше; Отличные коммуникативные навыки и умение находить общий язык с разными типами людей; Ориентация на клиента и способность быстро реагировать на изменения ситуации; Стрессоустойчивость и готовность работать в условиях многозадачности.  Условия  Обеспечение качественного и своевременного решения запросов клиентов; Консультирование клиентов по продуктам и услугам компании; Ведение базы данных клиентов и документооборот; Подготовка отчетов о проделанной работе и анализ удовлетворенности клиентов; Участие в разработке предложений по улучшению клиентского сервиса; Взаимодействие с другими отделами компании для обеспечения эффективного выполнения задач."
128047651,"Маркетинг-аналитик / CRM & Data Management (Bitrix24, B2B)",Москва,От 1 года до 3 лет,,"Юридическая компания BLS c 1998 года защищает интересы работодателей.Мы единственная в России узкоспециализированная компания, работающая только в трудовом праве. Среди наших проектов: представление в судах, разработка систем управления персональными данными, аутсорсинг HR-процессов, аудит и восстановление документов по охране труда, расследование несчастных случаев, оценка профрисков, сопровождение проверок гос. органов и многое другое.Среди наших клиентов – Русагро, SAP, GSK, Merz Pharma, Nissan, Dr.Reddy’s. Компания входит в лидеры в ведущих юридических рейтингах – Право.ру-300, Коммерсант, Эксперт, Best Lawyers, IAOP. В связи с расширением аналитической функции мы ищем:Маркетинг-аналитика / CRM & Data Management (B24, B2B) частичная занятость / гибрид или удалённо Что предстоит делать:  Анализировать маркетинговую и клиентскую базу в различных разрезах (продукты, отрасли, сегменты, каналы); Обогащать и структурировать данные, искать закономерности и точки роста; Формировать, автоматизировать и поддерживать регулярную отчётность для руководителей и смежных подразделений; Работать с CRM Битрикс24: выгрузки, настройка полей, отчетов; Писать ТЗ для разработчиков Б24 и контролировать реализацию; Подготавливать аналитические материалы и презентации для управленческих решений; Участвовать в проектах по оптимизации бизнес-процессов.  Что мы ожидаем от кандидата:  Опыт работы аналитиком в B2B-компаниях от года; Практический опыт работы с CRM Битрикс24; Умение переводить бизнес-задачи в аналитические модели и формировать выводы; Уверенная работа в Excel / Google Sheets (формулы, сводные таблицы, визуализация); Знание Python, SQL или других инструментов для работы с данными; Системное мышление, внимательность, умение структурировать данные; Будет плюсом опыт в юридических, консалтинговых или сервисных компаниях;  Что мы предлагаем:  Работа в сильной профессиональной среде; Возможность развивать аналитическую инфраструктуру компании; Конкурентную заработную плату (обсуждается индивидуально); 5/2 с 9:00 до 18:00, пятница — до 17:00, возможность работать удалённо/частичная занятость; Возможно оформление по ТК, ГПХ, самозанятость; Корпоративную скидку на обучение английскому языку; ДМС после 6 месяцев работы.  Ждём вас в нашей команде!"
128061542,Senior Data Scientist – Renewable Energy Trading,Москва,Более 6 лет,"Python, regression, ensemble learning, time series forecasting, Scikit-learn, XGBoost,, TensorFlow, PyTorch, CGP, Kubernetes, Terraform, CI/CD","We are a European leader in renewable energy and short-term algorithmic trading. Our SaaS solutions empower energy market participants by providing real-time forecasting, automated decision-making and bidding platform across European electricity markets. By merging advanced data science with cutting-edge cloud technology, we accelerate the global transition to a low-carbon energy system. Position Summary We are looking for a Senior Data Scientist with extensive experience in predictive modeling, stochastic optimization, and applied machine learning in commercial environments. In this role, you will own the design and performance of forecasting and trading models that directly shape our strategies across European power markets. You will work at the intersection of energy, AI, and trading, where precision and speed are critical. This is a high-impact position, suited for someone who thrives on translating complex datasets into actionable insights that drive multimillion-euro trading decisions. Your Responsibilities   Architect and deploy advanced ML models for forecasting electricity supply, demand, and prices across European markets.   Enhance and scale predictive pipelines to ensure robustness and performance under real-time trading conditions.   Apply stochastic optimization and decision-making under uncertainty to design strategies for short-term and intraday trading.   Define and monitor key model KPIs tied directly to trading results and business outcomes.   Collaborate with engineering teams to deliver scalable, production-grade solutions in a cloud-native environment.   Explore and evaluate new methodologies, algorithms, and technologies to maintain a competitive edge.   Contribute to the strategic roadmap of our company's data-driven trading solutions.   Your Profile   10+ years of proven experience in predictive modeling and applied ML in commercial settings, ideally with 5+ years in energy, finance, or trading domains.   Advanced degree (Master’s or PhD) in Mathematics, Econometrics, Physics, Data Science, or a related field.   Expertise in regression, ensemble learning, time series forecasting, and ML libraries such as Scikit-learn, XGBoost, TensorFlow, or PyTorch.   Strong programming skills in Python, with experience in end-to-end model development and deployment.   Solid understanding of stochastic optimization and decision-making under uncertainty.   Familiarity with cloud platforms (GCP preferred), containerization (Kubernetes), IaC (Terraform), and CI/CD practices.   Track record of delivering high-value data science solutions with measurable business impact.   Excellent communication skills, with the ability to turn complex analytics into clear business recommendations.    Comfortable communicating in English with an international team   Passion for renewable energy and a strong interest in electricity markets and trading.   Why You Will Love Working With Us   Be part of a company dedicated to renewable energy and global decarbonization.   Directly influence trading strategies and revenues across European power markets.   Work with diverse, high-volume datasets spanning commercial, market, and operational sources.   Shape the evolution of analytical tools and AI-powered features in a fast-moving domain.   Join a collaborative, innovative team where data science drives real-world results.   Contribute to a high-impact mission while enjoying the flexibility of remote work.   We kindly ask that only candidates who meet the listed requirements apply for this position. Please be aware that we will respond only to applicants whose profiles closely match the qualifications outlined above.----------------------------------------- Мы – европейский лидер в области возобновляемой энергетики и краткосрочной алгоритмической торговли. Наши SaaS-решения помогают участникам энергетических рынков, предоставляя платформу для прогнозирования в реальном времени, автоматизированного принятия решений и выставления заявок на рынках электроэнергии Европы. Объединяя передовые методы анализа данных с новейшими облачными технологиями, мы ускоряем глобальный переход к низкоуглеродной энергетической системе. Описание позицииМы ищем Senior Data Scientist с обширным опытом в области предиктивного моделирования, стохастической оптимизации и прикладного машинного обучения в коммерческой среде. В этой роли вы будете отвечать за разработку и результативность моделей прогнозирования и торговли, которые напрямую формируют наши стратегии на европейских энергетических рынках.Вы будете работать на стыке энергетики, искусственного интеллекта и трейдинга, где критически важны точность и скорость. Это позиция с высоким влиянием, которая подойдет человеку, умеющему превращать сложные массивы данных в практические инсайты, определяющие многомиллионные торговые решения. Обязанности   Проектировать и внедрять передовые ML-модели для прогнозирования производства, спроса и цен на электроэнергию на европейских рынках.   Совершенствовать и масштабировать предиктивные пайплайны для обеспечения надежности и производительности в условиях реальной торговли.   Применять стохастическую оптимизацию и методы принятия решений в условиях неопределенности для разработки стратегий краткосрочной и внутридневной торговли.   Определять и отслеживать ключевые KPI моделей, напрямую связанные с результатами торговли и бизнес-показателями.   Сотрудничать с инженерными командами для создания масштабируемых, промышленного уровня решений в облачной среде.   Изучать и внедрять новые методологии, алгоритмы и технологии для поддержания конкурентного преимущества.   Вносить вклад в стратегическую дорожную карту наших решений в области торговли на основе данных.   Ваш профиль   10+ лет подтвержденного опыта в предиктивном моделировании и прикладном ML в коммерческой сфере, желательно 5+ лет в энергетике, финансах или трейдинге.   Степень магистра или PhD в области математики, эконометрики, физики, data science или смежной дисциплины.   Экспертиза в регрессии, ансамблевом обучении, прогнозировании временных рядов и библиотеках ML (Scikit-learn, XGBoost, TensorFlow, PyTorch).   Отличные навыки программирования на Python и опыт полного цикла разработки и внедрения моделей.   Глубокое понимание стохастической оптимизации и методов принятия решений в условиях неопределенности.   Знание облачных платформ (предпочтительно GCP), контейнеризации (Kubernetes), IaC (Terraform) и практик CI/CD.   Подтвержденный опыт создания решений в области data science с измеримым бизнес-эффектом.   Отличные коммуникативные навыки, умение превращать сложную аналитику в понятные бизнес-рекомендации.   Умение общаться на английском языке в международной команде.   Увлеченность возобновляемой энергетикой и интерес к рынкам электроэнергии и трейдингу.   Почему вам понравится работать с нами   Вы станете частью компании, посвященной возобновляемой энергетике и глобальной декарбонизации.   Получите возможность напрямую влиять на торговые стратегии и доходы на европейских энергетических рынках.   Будете работать с разнообразными крупными наборами данных, охватывающими коммерческие, рыночные и операционные источники.   Сможете формировать развитие аналитических инструментов и функций на базе ИИ в быстроразвивающейся сфере.   Присоединитесь к сплоченной инновационной команде, где data science приносит реальные результаты.   Будете вносить вклад в миссию с высоким социальным значением, сохраняя при этом гибкость удаленной работы.   Мы вежливо просим откликаться на эту позицию только кандидатов, полностью соответствующих указанным требованиям.Пожалуйста, обратите внимание: мы сможем ответить только тем кандидатам, чей профиль наиболее соответствует перечисленным квалификациям."
128101728,Data Scientist в Блок Финансы,Москва,От 3 до 6 лет,,"Команда Дивизиона AI трансформации и исследования данных Блока Финансы ищет DSa на проект разработки мультиагентной системы ""AI финансовый аналитик"" (далее AIFA), которая предназначена для анализа финансовой отчетности компаний и формирования аналитических заключений.Обязанности Разработка агентов мультиагентной системы ""AI финансовый аналитик"", а также интеграции системы со смежными АС бизнес-блоков и вывода функциональности на поверхности, доступные для клиентов (DataTracker, CIB Research портал и др):  Проработка требований с заказчиками Разработка кода агентов Реализация функций агентов: извлечение показателей отчетности, реализация цепочек рассуждений, генерация аналитических заключений Реализация интеграций с базами данных, RAG, API GigaChat, прочими системами AI HUB'а и Банка Реализация UI и вывод функциональности агента на существующие поверхности, доступные клиентам (DataTracker и др) Разработка и согласование архитектуры агента Документирование решения  Создание тестовой корзины, контроль качества разметки Валидация агентов Ведение карточки агента в реестре агентов, в библиотеке моделей создание демо-стендов и проведение демонстраций заказчику Разработка ML-моделей и улучшение их целевых метрик Проработка кратчайшего пути от идеи до Пром с учетом арх. стандартов, требований производственного процесса и концептуальных архитектур АС ПКАП PALM 1098 и AI HUB БФ. Требования  высшее техническое образование опыт разработки ИИ-агентов, знание классического ML и LLM знание SQL, опыт написания сложных запросов опыт работы в банковской/финансовой сфере понимание механики a/b-тестирования. Условия -Комфортный офис у м. Кутузовский проспект, возможен гибридный формат работы -ежегодный пересмотр зарплаты, годовая премия -корпоративный спортзал и зоны отдыха -более 400 образовательных программ СберУниверситета для профессионального и карьерного развития -программа адаптации и помощь руководителя на старте -расширенный ДМС, льготное страхование для семьи и корпоративная пенсионная программа -ипотека выгоднее до 4% для каждого сотрудника -бесплатная подписка СберПрайм+, скидки на продукты компаний-партнеров -вознаграждение за рекомендацию друзей в команду Сбера."
128084268,"Senior Data Scientist, Моделирование продуктов B2C, Ozon Bank",Москва,От 1 года до 3 лет,"Data Science, Python, ML","Ozon Банк — это подразделение Ozon, где тесно переплетаются финансы и IT. Мы создаём инновационные продукты и сервисы для физических и юридических лиц. Гордимся атмосферой в командах: каждый сотрудник может влиять на процессы и результаты. Мы ищем профессионала, который сможет внести значительный вклад в развитие нашей команды кредитного скоринга для розничных клиентов. Многое мы уже сделали, многое еще предстоит (в том числе ряд базовых вещей). Нужен человек, знакомый с лучшими практиками рынка. При этом способный генерировать и реализовывать идеи, как превзойти текущие стандарты индустрии. В том числе, комбинируя классический подход, возможности, которые дает экосистема Озон и новые идеи, возникающие в сообществе. Вам предстоит:  Разрабатывать и поддерживать ML-модели для кредитования физических лиц Развивать и поддерживать внутренний фреймворк для разработки моделей Генерировать и применять в моделях новые фичи на основе новых источников данных Участвовать в постановке задачи, находить приоритетные направления для моделирования и прозрачно об этом рассказывать Разрабатывать и поддерживать сервисы для продового расчета моделей Анализировать эффективность моделей в проде, организовывать и дорабатывать мониторинг  Мы ожидаем:  Опыт работы в кредитном скоринге от 2 лет Умение работать с данными (анализ, очистка, подготовка, отбор и создание признаков), навыки написания сложных SQL-запросов Хорошее знание теории вероятностей, математической статистики и методов машинного обучения. В том числе знание типовых пайплайнов для построения скоринговых моделей. Опыт работы c пакетами для анализа данных Общие представления о валидации и способах построения мониторинга моделей"
