id,name,area,experience,key_skills,description
128582871,Data Analyst в WB ID,Москва,От 3 до 6 лет,,"Объединённая компания Wildberries и Russ — это международная технологическая компания, образованная в результате слияния двух лидеров рынка — IT-компании Wildberries и оператора наружной рекламы Russ. Сейчас мы расширяем направление Trust & Safety и находимся в процессе поиска опытного дата-аналитика, который поможет нам усилить направление.Вам предстоит:  Выстраивать систему метрик продукта; исследовать и поддерживать систему алертов и мониторингов для отслеживания подозрительных транзакций; выгружать данные из БД, заниматься построением витрин данных по направлению (мы используем Clickhouse);  строить и поддерживать отчеты Superset;   взаимодействовать с командой разработки, DS инженеров и DWH при определении необходимых данных для аналитики.   Вы нам подходите, если:   У вас есть опыт работы аналитиком данных от 2 лет;   вы обладаете опытом написания сложных SQL запросов и построения витрин;   у вас есть хорошее знание математики и статистики;   вы знаете Python и его аналитические библиотеки.   Условия для сотрудников:  Обучение и развитие: языковые клубы, собственный корпоративный университет, программы развития управленческих навыков и многое другое; Благополучие сотрудников: корпоративный пакет ДМС со стоматологией, корпоративный спорт, консультации психолога и дополнительные возможности аккредитованной IT-компании; Множество сообществ: клуб спикеров, футбола, йоги, шахмат и т.д.; Забота о семьях: создаем условия, в которых легко сочетать карьеру и заботу о близких – от гибкого подхода до масштабных проектов для детей сотрудников; Скидки и партнерские программы: на обучение, страхование, покупки и многое другое; Комфортная рабочая среда: бесплатное питание в офисе, современные офисы рядом с метро, корпоративная техника и портал для сотрудников."
128587121,Data analyst,Москва,От 1 года до 3 лет,"SQL, Python, Greenplum, Apache Airflow, Apache NiFi, Apache Kafka","ОДИН ИЗ ЛУЧШИХ РАБОТОДАТЕЛЕЙ РОССИИ Мы – Neoflex. Аккредитованная IT компания. За 20 лет работы мы создали 12+ готовых решений для бизнеса, так же занимаемся заказной разработкой программного обеспечения. Приветствуем на странице нашей компании и благодарим за интерес к вакансии. Будем рады оказаться полезны друг другу. Стек: SQL, python, Greenplum, postgreSQL, S3, Airflow, nifi, kafka Чем предстоит заниматься:   Работа с большими данными, проведения EDA (Разведочный анализ данных (англ. exploratory data analysis)   Анализ информации и формулирование гипотез (включая выявление актуальных проблем)   Изучение внутренних источников данных, извлечение инсайтов, формулирование и проверка гипотез на основе данных, выявление ключевых проблем и точек роста   Поиск и анализ узких мест в бизнес-процессах, предложение возможных решений на основе данных  Участие в формировании и проверке бизнесовых гипотез Сценарное моделирование как по предложенным бизнесом сценариям, так и предложение собственных сценариев по итогам получаемых результатов Разработка алгоритмов и числовых, в т.ч. статистических, моделей Интерпретация и представление результатов бизнес-заказчику Участие в сверке фактических и смоделированных показателей, по принятым к реализации гипотезам, проведение факторного анализа Анализ результатов по выведенным в прод алгоритмам Подготовка структурированных выводов и рекомендаций для команды и заинтересованных сторон Работа с бизнес заказчиком, дата специалистами, разработчиками и менеджерами Документирование своей работы в виде принятом на проекте  Что мы хотели бы видеть:  Опыт работы в качестве дата аналитики или продуктового аналитикаи от 2х лет Представление о мат статистике и теории вероятности Опыт анализа/изменения бизнес процессов Опыт работы с Python в части анализа данных (стандартная библиотека, pandas, numpy и пр.) Опыт работы в качестве аналитика на ретейл проектах Уверенные знания в SQL  Что ты приобретёшь, присоединившись к нам:  достойную оплату труда + компенсационные, стимулирующие и мотивационные выплаты, бонусы за участие в реферальной программе; работа в команде профессионалов готовых делиться экспертизой; официальное трудоустройство по ТК РФ, аккредитация IT, расширенный социальный пакет:  ✔️ страховка ДМС (с 3-го месяца работы, стоматология, возможность подключения родственников, теле медицина, полис ВЗР), ✔️ сотрудникам со стажем в Neoflex более 3 месяцев при предоставлении листка нетрудоспособности устанавливается доплата до полного заработка за период болезни, ✔️ обучение детей сотрудников ИТ специальностям, ✔️ компенсация затрат на фитнес и занятия английским языком;  обеспечиваем техникой для работы (ноутбук, наушники, мышь); профессиональное развитие - в Учебном Центре (курсы по работе с большими данными, видео лекции, тренажеры, карьерный коучинг, лекции, тренинги, конференции, участие в митапах); возможность пройти проф.сертификацию; прозрачную систему карьерного развития Performance Review; персонального куратора с первого дня работы; насыщенную корпоративную жизнь: яркие корпоративы, праздники для детей сотрудников, корпоративные спортивные мероприятия, мотивационные награждения; комфортную атмосферу в филиалах компании в городах: Москва, Санкт-Петербург, Нижний Новгород, Пенза, Воронеж, Саратов, Самара, Краснодар где есть лаунж и фотозоны, вендинги в кухнях, пространство для медитаций и другие секретные места, о которых знают только наши сотрудники. удалённый формат работы."
128586020,Специалист по управлению данными / Аналитик данных (Data Analyst/Data Engineer),Москва,От 1 года до 3 лет,"СУБД, MS SQL, MySQL, PostgreSQL, Data Analysis, ETL, DWH, Apache Airflow, Clickhouse, Greenplum, Python, RabbitMQ","Обязанности:   Реализация шаблонов заполнения в системе сбора отчетов в low-code системе;   Проектирование и поддержка витрин данных для BI-аналитики;   Разработка и автоматизация дашбордов в BI-системах;   Реализация ETL-процессов;   Взаимодействие с аналитиками, разработчиками и бизнес-заказчиками;   Автоматизация процессов обработки данных.   Требования:   Опыт от 1 года в области анализа данных;   Уверенные знания SQL (JOIN, CTE, оконные функции, агрегаты, подзапросы);   Понимание ETL-процессов и базовых принципов работы с данными;   Понимание архитектуры построения DWH;   Понимание ETL/ELT процессов и опыт работы с инструментами (Apache Airflow);   Опыт работы с Python (pandas, numpy и др.);   Опыт работы с BI-инструментами (знание Metabase будет плюсом);   Способность объяснять сложные вещи простым языком, взаимодействовать с бизнес-заказчиком.   Условия:  Работа в стабильной и крупной компании, входящей в контур управления АО ""Технодинамика"" Государственной Корпорации ""Ростех"" (интегратор, единый центр компетенций по ИТ и ИБ, обеспечивает функционирование ИТ-инфраструктуры организаций ОПК, партнер крупных вендоров); Аккредитованная ИТ-компания; Оформление в соответствии с ТК РФ; График работы 5/2, гибкое начало рабочего дня; Местонахождение офиса: м. Третьяковская (5 минут пешком), м. Новокузнецкая (5 минут пешком); Служебный транспорт и корпоративная мобильная связь; Социальные льготы и выплаты от работодателя; ДМС (со стоматологией); Возможности для карьерного роста и профессионального развития (повышение квалификации и обучение)."
128583287,Data analyst (Финмониторинг),Москва,От 3 до 6 лет,,"Объединённая компания Wildberries и Russ (ООО «РВБ») — это международная технологическая компания, основанная в России.Она образована в результате слияния двух лидеров рынка — IT-компании Wildberries и оператора наружной рекламы Russ — с целью совместного создания новейшей цифровой торговой платформы и предоставления бесшовных инструментов для развития малого и среднего бизнеса на территории стран присутствия. Финтех направление самого крупного маркетплейса активно масштабируется. Мы создаём собственную платежную инфраструктуру, включая банковские и небанковские продукты. Мы находимся в поиске Дата аналитика для построения и развития подразделения финансового мониторинга. Вам предстоит заниматься:   Выполнение аналитической функции в направлении Финансового мониторинга;   Разработка и поддержка оперативной и управленческой отчетности: от анализа источников данных и сбора информации до расчета показателей и создания интерактивных дашбордов;   Автоматизация системы алертов и рассылок для оперативного мониторинга качества данных и ключевых бизнес-метрик;   Проведение глубокого анализа данных для выявления продуктовых инсайтов и закономерностей;   Подготовка ad-hoc выгрузок и отчетов по запросам бизнес-пользователей   Что мы ожидаем:   Уверенный опыт работы с SQL - от 3 лет;   Опыт работы с Python;   Понимание теории вероятности и математической статистики;   Опыт работы в продуктовой или data-аналитике.   Мы предлагаем:   Удаленный формат работы на территории РФ или гибрид из офиса в Москве;  Официальное оформление в соответствии с ТК РФ; Бесплатное питание на собственной оборудованной кухне, а также вендинговые аппараты; Корпоративные скидки у партнеров, внешние программы по обучению и внутренние митапы; Максимум возможностей для профессиональной самореализации;  Интересные и сложные проекты и уникальный опыт."
128598787,Data-аналитик,Москва,От 3 до 6 лет,"Python, SQL, Greenplum, Git, Power BI, Tableau, S3, Docker, Apache Airflow, Apache NiFi, Apache Kafka","Привет! Мы ищем в команду Data-аналитика (Middle+/Senior). ⠀ Для нас привлекательны следующие знания и опыт:   Опыт работы с данными от 2 лет: уверенная работа с большими массивами информации, понимание логики бизнес-процессов и того, как они отражаются в данных.   Уверенное владение Python для анализа (pandas, NumPy и стандартные инструменты).   Хорошее знание SQL.   Базовая статистика и вероятность — понимание ключевых концепций.   Опыт в аналитике (продуктовой или классической) не менее двух лет.   Практика в изучении или оптимизации бизнес-процессов, либо готовность развиваться в этом направлении.   Работа с разными типами хранилищ: распределённые системы (например, Greenplum), реляционные базы (PostgreSQL).   Умение пользоваться Git и основными библиотеками визуализаций (matplotlib, seaborn и т.п.).   Навыки работы в BI-системах (Power BI, Tableau).   Опыт использования S3-подобных хранилищ, Docker, Airflow/NiFi, Kafka.     Решайте интересные задачи:   Разовые и регулярные аналитические исследования , помогающие принимать решения.   Проверка и формирование гипотез, моделирование сценариев развития и анализ последствий.   Обсуждение подходов с командой и бизнес-стейкхолдерами.   Разработка алгоритмов и статистических моделей под конкретные задачи.   Представление выводов заказчикам и объяснение полученных результатов.     Мы ждем тебя в команду SSP SOFT!"
128008973,Аналитик данных / Data инженер,Москва,От 3 до 6 лет,"SQL, PostgreSQL, ETL, Apache Airflow, Greenplum, Clickhouse, Apache Superset","О компании: Мы — динамично развивающаяся компания в сфере FinTech, работающая как Payment Service Provider (PSP). В основе нашей работы — данные, и мы ищем специалиста, который поможет нам вывести работу с ними на новый уровень. О проекте: Мы построили корпоративное хранилище данных (DWH) на базе PostgreSQL. Для визуализации и бизнес-аналитики будем использовать Apache Superset (дополнительное знание MSPower BI будет преимуществом). Основная задача для кандидата - в составе финансового департамента возглавить работу с данными, обеспечить их качество и доступность. Ключевые задачи и обязанности: Работа с данными и инфраструктурой (Функции Data Owner):   Администрирование и развитие корпоративного DWH на PostgreSQL: оптимизация производительности, обеспечение бесперебойной работы.   Разработка, поддержка и мониторинг ETL/ELT процессов для загрузки данных из операционных систем (платежные шлюзы и тд).   Обеспечение качества, актуальности, целостности и консистентности данных в хранилище.   Консультирование бизнес-подразделений по вопросам доступности и интерпретации данных.   Бизнес- и финансовая аналитика:   Разработка, обновление и поддержка дашбордов и отчетов в Apache Superset для мониторинга ключевых бизнес-показателей   Подготовка регулярных и ad-hoc отчетов для менеджмента и других подразделений компании   Мы ищем кандидата, который: Обязательно:   Имеет опыт работы дата-аналитиком от 3 лет.   Обширные познания в Apache Airflow, Greenplum, ClickHouse   Свободно владеет SQL (на уровне написания сложных запросов, оконных функций, оптимизации).   Имеет практический опыт администрирования, разработки и оптимизации PostgreSQL (знание индексов, партиционирования, EXPLAIN ANALYZE).   Имеет уверенный опыт построения дашбордов и визуализации в Apache Superset.   Имеет опыт построения и поддержки ETL/ELT процессов.   Обладает аналитическим складом ума, внимателен к деталям и умеет работать с большими объемами информации.   Приветствуется:   Опыт работы в FinTech, банковской сфере или в качестве PSP."
