id,name,area,experience,key_skills,description
127868408,ML-разработчик (NLP) в Дзен,Москва,От 1 года до 3 лет,"NLP, ML","Дзен — это рекомендательная система и блог-платформа, которая помогает миллионам людей находить интересный контент, а авторам — свою аудиторию. Мы команда, которая разрабатывает и поддерживает контентные модели для всех сервисов Дзена.Вы будете разрабатывать и внедрять современные модели машинного обучения, решающие ключевые задачи для Дзена. Основной фокус — NLP. Ваша работа охватит весь жизненный цикл ML-решения: от постановки задачи и сбора данных до обучения, оценки качества и внедрения в production. Ваша работа напрямую повлияет на качество и интеллектуальность сервисов Дзена для миллионов пользователей. Основные задачи  Разрабатывать, обучать и внедрять DL-модели для задач: генерация, классификация, сегментация, семантическая схожесть и другие Исследовать и применять LLM для создания агентных пайплайнов, решающих сложные задачи для пользователей Проектировать и реализовывать полный ML-пайплайн: от данных до бизнес-метрик Оптимизировать и ускорять инференс DL-моделей для production Проводить эксперименты на мощном железе, включая кластеры с GPU H100  Требования  Опыт работы в ML/DL от двух лет Глубокие теоретические знания в ML, DL и особенно в NLP Практический опыт с PyTorch и Hugging Face Способность самостоятельно формализовать, спроектировать и реализовать ML-пайплайн: от сбора и подготовки данных до выбора архитектуры, обучения, валидации и внедрения Умение корректно оценивать качество моделей, подбирать и интерпретировать метрики Готовность работать в research-ориентированной среде, генерировать и проверять гипотезы  Будет плюсом  Понимание или опыт работы с архитектурами Encoder, Decoder, Encoder-Decoder Знание методов ускорения DL-моделей (квантование, дистилляция, оптимизация инференса) Опыт с PyTorch, Hugging Face Transformers, PyTorch Lightning, TensorRT-LLM или аналогичными фреймворками Опыт работы с большими языковыми моделями (LLM) и построением агентных пайплайнов Готовность участвовать в командных обсуждениях, делиться идеями и предлагать нестандартные решения"
127869009,Full Stack Data (engineer + analyst),Москва,От 3 до 6 лет,,"КОМПАНИЯ «АЙ-ТЕКО» - ведущий российский системный интегратор и поставщик информационных технологий для корпоративных заказчиков. Активно действует на рынке IT России с 1997 года, входит в ТОП-400 крупнейших российских компаний, ТОП-10 крупнейших IT-компаний России. В связи с активным развитием проектов в компании открыта вакансия Data Engineer/Data аналитика. От кандидата ожидаем:  уверенное знание SQL, понимание нормализации, опыт разработки витрин; опыт построения хранилищ, витрин, моделей данных; логическое мышление, структурированное выражение своих мыслей устно и письменно.  Мы ищем Full Stack Data Analytics Engineering, который поможет намсоздавать решения по выводу различных BigData артефактов в ПРОМ:  70% времени занимает аналитика, 30% - разработка взаимодействовать с бизнес-заказчиком, анализировать, уточнять и согласовывать требования; разрабатывать модели данных витрин создавать проектную документацию (требования, S2T, модель данных, описание логики трансформации); согласовывать решения с архитекторами заказчика и презентовать результаты; работа с данными: анализ, внедрении и отслеживании данных Проектирование и построение прототипов, витрин Проектирование и разработка потоков данных Построение таблиц с версионированием данных (бизнес/техническая история , ескд2)  Мы предлагаем:  Работу в стабильной компании, ""белую"" заработную плату; Оформление в соответствии с ТК РФ с первого дня работы; Расширенный социальный пакет: ДМС (включая стоматологию), корпоративные скидки на посещение фитнес-клубов, футбольная и волейбольная секции; Профессиональное обучение и развитие; Яркая и насыщенная корпоративная жизнь; Снабжаем всей необходимой современной техникой."
127868589,"Data Scientist, Аналитический Департамент",Москва,Более 6 лет,"Python, SQL, CV, NLP","Задачи  Разработка и оптимизация мультиагентных систем, включающих в себя CV, NLP и анализ time-series; Разработка ML инструментов, повышающих эффективность индустриальной аналитики (нефтегаз, металлургия, агро и прочее); Разработка ML инструментов для цифровизации бизнес-процессов на основе генеративных алгоритмов (включая разработку AI-ассистентов); Разработка инструментов парсинга и обработки данных из внешних источников; Взаимодействие с командами внедрения и секторальными аналитиками.  Требования  Опыт в Data Science и разработке на Python не менее 4х лет Опыт построения ML моделей / разработки MVP Опыт работы с многопоточностью, многопроцессностью Знание алгоритмов машинного обучения Знание основ построения генеративных моделей Знание tensorflow, pytorch, CUDA Знание SQL Английский язык от intermediate  Условия  Формат работы: полный рабочий день в офисе; Конкурентная заработная плата; Профессиональное обучение и развитие; Добровольное медицинское страхование сотрудника и несовершеннолетних членов семьи, страхование жизни и здоровья."
127866887,Senior Data Analyst (Баланс Продавцов),Москва,От 3 до 6 лет,,"Объединённая компания Wildberries и Russ — это международная технологическая компания, образованная в результате слияния двух лидеров рынка — IT-компании Wildberries и оператора наружной рекламы Russ. Баланс Продавцов — мы учитываем все события в процессе работы селлера с нашей площадкой, и сводим эти события в единый финансовый баланс продавцов, а также подкрепляем этот баланса финансовыми документами и отчетами.Вам предстоит:  Проектировать, разрабатывать и поддерживать аналитические решения и data-пайплайнов; разрабатывать и поддерживать работоспособности аналитических дашбордов (redash); анализировать данные с использованием статистических методов, проверять гипотезы; делать ревью кода и аналитических решений коллег; учувствовать в построении и развитии архитектуры DWH и контроля качества данных (DQ); взаимодействовать с продуктовыми, аналитическими и инженерной командами.  Вы нам подходите, если:  ​​​​​​​Глубоко владеете SQL и аналитическими СУБД: ANSI SQL, PostgreSQL (включая работу с индексами и шардированными базами) и ClickHouse (понимание движков, архитектурных особенностей, сильных и слабых сторон). Опыт с Trino будет преимуществом; имеете опыт работы с распределёнными вычислениями и big data-стеком: pySpark/Spark SQL 3.0+ и практический опыт работы в Hadoop-экосистеме (включая HDFS, YARN, Hive, Iceberg), а также понимание архитектуры кластеров; имеете навыки автоматизации и оркестрации аналитических процессов: Airflow 2.0+ для построения и поддержки ETL/ELT- пайплайнов; уверенно владеете Python для аналитики и обработки данных: pandas/polars, numpy и библиотек визуализации (например, matplotlib, seaborn, plotly); понимаете архитектуру и принципы хранения данных: понимание различий между реляционными и NoSQL-хранилищами, моделей построения хранилищ данных (DWH), типов медленно меняющихся измерений (SCD типов 1-3), нормальных форм и современных подходов к управлению данными (Data Quality, Data Governance, Data Lineage); понимаете работу с потоковыми данными: REST API (GET/POST/PUT/DELETE) и Apache Kafka (сериализация, retention, форматы хранения, архитектура брокеров и лидов).  Условия для сотрудников:  Обучение и развитие: языковые клубы, собственный корпоративный университет, программы развития управленческих навыков и многое другое; Благополучие сотрудников: корпоративный пакет ДМС со стоматологией, корпоративный спорт, консультации психолога и дополнительные возможности аккредитованной IT-компании; Множество сообществ: клуб спикеров, футбола, йоги, шахмат и т.д.; Забота о семьях: создаем условия, в которых легко сочетать карьеру и заботу о близких – от гибкого подхода до масштабных проектов для детей сотрудников; Скидки и партнерские программы: на обучение, страхование, покупки и многое другое; Комфортная рабочая среда: бесплатное питание в офисе, современные офисы рядом с метро, корпоративная техника и портал для сотрудников."
127878847,Junior/middle LLM Data Scientist (Риски),Москва,От 1 года до 3 лет,,"Наша команда занимается оценкой и независимым контролем за моделями Банка. В наши задачи входит всесторонне проверять разработанные ai-решения, челленджить выбранные подходы, предлагать более эффективные алгоритмы и подходы к решению задач бизнеса. Сейчас процесс проверки автоматизируется при помощи LLM, в связи с чем расширяется команда и мы ищем сильных кандидатов на ряд позиций Junior/Middle LLM Data Scientist. Обязанности  переводить с языка бизнес-заказчика на язык DS глубоко погружаться в предметную область - валидация моделей проводить полный цикл разработки ai-решения с конкретной бизнес-пользой: анализ бизнес-задачи, сбор и анализ данных, разработка, валидация, внедрение, мониторинг, анализ работы и формирование новой задачи рисерчить SOTA к оценке и разработке решений на основе LLM  Стек: python, ML-стек, faiss, langchain, smolagents, huggingface, vllm и др. Железо: свой GPU-кластер приличных размеров 3 ноды по 8 H-100. Требования  высшее образование в области компьютерных/технических/физико-математических наук более  2 лет в ML, более года работы с NLP глубокое понимание теории ML, мат. статистики и тер. вероятности базовые знания bash, git проактивность в решении задач, умение декомпозировать большие задачи на решаемые  Будет плюсом:  опыт создания индустриальных решений / pet project с LLM.  Условия  возможность внести вклад в развитие самой перспективной сферы — искусственный интеллект участие в уникальных масштабных проектах по развитию AI комфортный современный офис рядом с м. Кутузовская формат работы: гибрид ежегодный пересмотр зарплаты и годовая премия корпоративный спортзал и зоны отдыха более 400 образовательных программ СберУниверситета для профессионального и карьерного развития расширенный ДМС, льготное страхование для семьи и корпоративная пенсионная программа гибкий дисконт по ипотечному кредиту, равный 1/3 ключевой ставки ЦБ бесплатная подписка СберПрайм+, скидки на продукты компаний-партнеров вознаграждение за рекомендацию друзей в команду Сбера."
127801775,Senior Data Analyst в Службу портфельного анализа СМБ,Москва,От 3 до 6 лет,"SQL, Python, Hadoop","Обязанности:  разработка витринного слоя данных блока ""Риски малый бизнес"" (модель данных); создание витрин данных; разработка и поддержание в актуальном состоянии документации по разработанному функционалу; регулярное наполнение витрин актуальными данными (преобразование, загрузка, обработка данных); постоянная оптимизация процессов поставки данных под бизнес требования; создание системы контроля качества данных; извлечение / трансформация / загрузка данных; работа с разными источниками данных: json, csv, excel, выгрузки из хранилищ данных (как реляционных так и файловых); работа с заказчикам и требованиями: разработка, поиск источников данных под требования заказчиков.  Требования:  высшее образование; опыт создания и развития витрин данных; обязателен опыт работы обязателен с SQL, Python, Hadoop; опыт в сфере разработки витрин данных не менее 3-5 лет. желательны знания в области РСБУ и МСФО резервирования; желательны знания в области скоринговых моделей для кредитования СМБ; опыт взаимодействия с контролирующими и регулирующими работу Банка организациями (внутренний аудит, ЦБ); опыт работы в банковской сфере (аналитика портфеля/кредитные или интегрированные риски/BIG4) будет преимуществом."
127871241,Senior Data Scientist в Центр моделирования (Риски),Москва,От 3 до 6 лет,"Python, Greenplum, Hadoop, PySpark, Airflow","Чем предстоит заниматься:  Разработка и улучшение моделей для рисков и антифрод-направления (классический ML, DL); Разработка CV моделей для задач антифрод-направления; Сопровождение процесса продуктивизации моделей; Возможность начать лидировать одно из направлений (риск-моделирование / антифрод-моделирование / моделирование для CVM) и участвовать в его техническом развитии  Требования:  Опыт коммерческой разработки ML/DL-моделей; Сильные знания в одном из направлений:• классический ML (табличные данные, скоринг, антифрод)• классический DL (CV, Transformers, RNN) Продвинутое владение Python, системами контроля версий (Git) и трекинга экспериментов (DVC, MLFlow).  Хочешь влиять на решения Банка с помощью данных и моделей? Присоединяйся!"
