id,name,area,experience,key_skills,description
128149842,ML-разработчик ранжирования и рекомендаций в Яндекс Вертикали,Москва,От 1 года до 3 лет,Python,"Журналы Вертикалей — это медиа Авто.ру, Яндекс Путешествий, Яндекс Недвижимости и Яндекс Аренды. Каждый месяц к нам приходят миллионы пользователей, чтобы найти ответы на вопросы, зарядиться эмоциями, вдохновиться идеями. Мы хотим, чтобы наши читатели всегда получали то, что им нужно, и с нашей помощью узнавали ответы даже на те вопросы, которые ещё не успели себе задать. У нас уже несколько миллионов активных пользователей в месяц, и мы хотим делать для них лучший информационный сервис. А для этого, кроме хорошего контента и удобного продукта, нужны классные рекомендации, которые:  увлекут каждого читателя так, что он будет переходить из статьи в статью и возвращаться каждый день; покажут самые подходящие предложения основных сервисов, выгодные и пользователю, и бизнесу; определят, кому какие показывать баннеры, виджеты, поп-апы и прочее.  У нас вы сможете:  познакомиться с рекомендательными технологиями Яндекса; поработать с трансформерами на истории действий пользователя; поучаствовать в разработке фундаментальной модели Журнала.  Какие задачи вас ждут Разработка рекомендательной системы ЖурналаВам предстоит создавать и внедрять гибридную систему рекомендаций, которая объединит контентные и коллаборативные подходы. Реализовывать механизм персонализации контента на основе поведения пользователей. Разрабатывать алгоритмы для предсказания интересов пользователей на основе их истории взаимодействия с контентом.   Аналитика и оптимизацияВы будете анализировать поведение пользователей для выявления новых паттернов. Оптимизировать алгоритмы под различные сегменты пользователей. Разрабатывать систему автоматического выявления проблем в работе рекомендаций. Мы ждем, что вы  Имеете опыт в обучении рекомендательных систем Обладаете хорошими теоретическими знаниями в области ML Уверенно владеете Python, знаете стандартные библиотеки для работы с ML-моделями Работали с оркестрацией ML-пайплайнов с помощью Airflow или Luigi  Будет плюсом, если вы  Занимались интеграцией ML в продукт, например в рекомендательные системы Применяли DL в задачах генерации персонализированного контента Работали со сложной валидацией продакшн-решений: A/B-тестированием, causal inference"
128004617,Senior Data Analyst,Москва,От 3 до 6 лет,,"Чем предстоит заниматься:   Проектирование интеграционных ETL процессов по загрузки данных из источников в DWH с применением трасформаций на основе спецификации хранилища   Участие в проекте миграции с Oracle в качестве аналитика   Взаимодействие с продукт-менеджерами, инженерами, дизайнерами   Ведение документации, описаний витрин, бизнес-логики метрик     Наши ожидания от кандидата:   Уверенное владение SQL (в приоритете диалекты Oracle, PostgreSQL),знание CTE и умение писать сложные запросы + DML запросы   Понимание структуры DWH (слои). Владение одной из методологий построения DWH   Понимание процессов ETL/ELT   Навыки работы с Apache Airflow   Навыки системного анализа и ведения технической документации   Навыки работы с Jira + Confluence или аналогичное   Навыки работы с Git     Что мы предлагаем взамен:  Стабильный и прозрачный доход: размер заработной платы обсуждается по итогам собеседования + квартальная премия по результатам KPI Гибкий график работы: вы сможете планировать время так, как удобно вам и вашей команде Полную удалёнку или гибрид на выбор, а также уютный ИТ-хаб в Москве, Санкт-Петербурге, Екатеринбурге и сезонный коворкинг в Сочи Сложные и интересные задачи, современный стек технологий Заботу о вашем здоровье: программа ДМС с первых дней работы, куда входит стоматология, обслуживание в лучших клиниках города, страхование и компенсация 10-ти дней больничного Возможность вертикального и горизонтального карьерного роста: регулярно проходят тренинги, вебинары, митапы и демо-дни Оплату посещения профильных конференций и курсов, помогаем с подготовкой к публичным выступлениям и написанием статей на Хабр Доступ к бесплатным корпоративным библиотекам Alpina Digital, MyBook и бизнес-изданий Предложения от Банка только для сотрудников: собственные спортзалы (Москва, Санкт-Петербург, Екатеринбург), а также скидки на услуги туристических агентств, продукты питания, в рестораны, бары, магазины"
128102901,Senior Data Scientist,Москва,От 3 до 6 лет,,"О работодателе:Аккредитованная ИТ-компания.Отечественный разработчик корпоративного ПО приглашает Data Science специалиста для работы над интеграционной платформой ESB. Чем предстоит заниматься:• создавать начальный датасет prompt → YAML для маршрутов Camel (вручную + синтез);• разрабатывать пайплайн аннотации логов (аномалия, событие, причина);• проверять точность генерации OpenAPI и разрабатывать критерии оценки качества;• собирать embedding-корпус по документации ESB и Camel;• сравнивать Pinecone и Qdrant на реальном retrieval latency и relevance;• проектировать логику агентов;• определять цепочки взаимодействия LLM (prompt flows, tools, context);• работать с LLM и RAG;• участвовать в fine-tuning и выборе моделей;• передавать знания в dev-команду и ML-инфраструктуру. Что для нас важно:• Python, Pandas, JSON, PyYAML, Jupyter;• обработка логов, YAML, XML, Camel DSL, Markdown, .http файлы;• ML / LLM Prompt Engineering, RAG, LangChain, transformers;• OpenAI embeddings, SentenceTransformers, Pinecone, Qdrant;• metrics design (BLEU, cosine, factual score, hallucination);• синтез обучающих данных: JSONL, prompt-response sets;• manual + semi-auto markup workflows;• Precision@k, F1, HitRate, Retrieval latency;• seaborn / matplotlib, графы последовательностей;• Git, Issues, PR-review, Markdown. Дополнительно оценим:• опыт с Apache Camel (чтение DSL, понимание маршрутов);• опыт участия в обучении моделей (LoRA, SFT);• знание LLM-evaluation фреймворков (TruLens, DeepEval, Ragas);• навыки генерации synthetic datasets и/или использования OpenAI functions. Условия:• участие в создании продуктовых решений международного уровня, ориентированных на эффективное ведение бизнеса для наших партнёров;• гибкое начало дня и возможность работать удалённо из любой точки;• просторный удобный офис (Санкт-Петербург);• ДМС со стоматологией для сотрудника и выгодные условия приобретения полисов ДМС для всей семьи;• выстроенная система наставничества с первого дня адаптации и обучение за счёт компании: повышение экспертизы в разных продуктовых командах, внешние курсы, корпоративный университет и библиотеки, участие в IT-конференциях, в том числе в качестве спикера;• индивидуальный подход к выбору корпоративных льгот: спорт, изучение иностранных языков, здоровье, обучение (в том числе для детей);• корпоративные тарифы на сотовую связь;• компенсация за использование личного оборудования."
128097161,Старший специалист по разработке нейронных сетей (Middle\Senior Data Scientist),Москва,От 3 до 6 лет,,"Группа Компаний Орбита - ведущий разработчик цифровых решений, российская аккредитованная ИТ-компания. Масштабный технологический проект с глубокой экспертизой в цифровизации бизнеса. Ключевые отрасли: государственный сектор, FinTech, HR Tech, коммуникации и медиа, услуги, рынок недвижимости, travel. Нам доверяют крупнейшие компании РФ, среди них: Т1, ВТБ, Иннотех, Альфа Банк, ОИС и другие. Более 6 лет мы ведем собственную продуктовую и заказную разработку высокоэффективных цифровых решений. Сейчас мы ищем Старшего специалист по разработке нейронных сетей (Middle\Senior Data Scientist) в Банк ТОП-5. Обязанности:  Разрабатывать, поддерживать и внедрять модели в процессы банка с упором на Change-деятельность (развитие новых, ещё не опробованных в банке подходов) Участвовать в коммуникации с бизнес-заказчиками: проводить интервью заказчика, формулировать технические и бизнес-требования к разрабатываемым моделям, презентовать результаты разработки моделей, оценивать их финансовый эффект. Оптимизировать и дорабатывать внутренних фрейморков для борьбы с рутиной Разрабатывать дизайн экспериментов для оценки качества моделей в бизнес-процессах. Совместно с командой DE реализовывать ETL-процессы подготовки данных для моделей. Совместно с командой MLOps отвечать за внедрение моделей в систему исполнения и дальнейшую интеграцию с системами заказчика. Совместно с командой мониторинга ставить разработанные модели на регулярный мониторинг. Искать и проверять гипотезы по улучшению моделей за счет использования новых источников данных и архитектур.    Требования:  Знания в RL и Графовых нейросетях Отличные знания в области классического ML и DL Подтверждённый опыт реализации и внедрения моделей в бизнес-процессы Как большой плюс - опыт в построении моделей рисков Опыт работы с ""джентельменским"" набором DL инженера: torch, pandas, numpy, networkX, PyG, matplotlib, classicML libs Опыт работы с системами хранения и обработки данных, у нас hdfs/spark    Что мы предлагаем:  Удалённый формат работы; Деньги: белую ЗП всегда в рынке, оформление ТК РФ; Комфортный старт: 3 месяца плавного погружения под присмотром HR; Поддержка: ИТ-отсрочку и HR / юридические консультации 24/7; Культура: прозрачные процессы и открытую коммуникацию; Мощное железо: работу на лучших компах, мы не логируем время, у нас фокус на доверии и результате; ДМС: твое лечение за счет компании; Развитие: индивидуальный план обучения, конференции и митапы, мы помогаем развиваться и строить карьеру; Личный бренд: выступления на конференциях, митапах, написание статей; Бенефиты: ежеквартальное обновление корпоративных скидок; Движ: вечеринки оффлайн и онлайн, мерч, конкурсы и челленджи."
128019066,Data Scientist/ML инженер,Москва,От 3 до 6 лет,"Python, RL, ML","Старший специалист по разработке нейронных сетей Ищем человека на роль Senior/middle Data Scientist в направление работы с внутренними клиентами отдела Монетизации нейронных сетей, отдел отвечает за разработку R&D решений для Core-бизнеса банка.Тебе предстоит решать сложные и амбициозные задачи на стыке различных направлений деятельности: оценка риска, cltv, склонность, рекомендации.На данной позиции предстоит заниматься задачами, связанными с графами и/или RL для оптимизации процессов принятия решенийОбщаться с бизнес-заказчиками и контрагентами, ответственными за все этапы жизненного цикла моделей.Команда сфокусирована на построении сложных процессов и моделей на стыке R&D и Run деятельности, поэтому на позиции будет очень важны hard-скиллы Опыт работы по специальности: от 3-х лет. Основные требования:  Высшее образование Знания в RL и Графовых нейросетях Отличные знания в области классического ML и DL Подтверждённый опыт реализации и внедрения моделей в бизнес-процессы Как большой плюс - опыт в построении моделей рисков Опыт работы с ""джентельменским"" набором DL инженера: torch, pandas, numpy, networkX, PyG, matplotlib, classicML libs Опыт работы с системами хранения и обработки данных, у нас hdfs/spark    Должностные обязанности:  Разрабатывать, поддерживать и внедрять модели в процессы банка с упором на Change-деятельность (развитие новых, ещё не опробованных в банке подходов) Участвовать в коммуникации с бизнес-заказчиками: проводить интервью заказчика, формулировать технические и бизнес-требования к разрабатываемым моделям, презентовать результаты разработки моделей, оценивать их финансовый эффект. Оптимизировать и дорабатывать внутренних фрейморков для борьбы с рутиной Разрабатывать дизайн экспериментов для оценки качества моделей в бизнес-процессах. Совместно с командой DE реализовывать ETL-процессы подготовки данных для моделей. Совместно с командой MLOps отвечать за внедрение моделей в систему исполнения и дальнейшую интеграцию с системами заказчика. Совместно с командой мониторинга ставить разработанные модели на регулярный мониторинг. Искать и проверять гипотезы по улучшению моделей за счет использования новых источников данных и архитектур."
128134600,Data analyst (офис),Санкт-Петербург,От 1 года до 3 лет,,"BELL INTEGRATOR – крупный системный интегратор страны. Мы являемся аккредитованной ИТ– компанией.На текущий момент с нами работает более 2500 высококлассных аналитиков, руководителей проектов, разработчиков, тестировщиков и специалистов по сопровождению крупных информационных систем. Bell Integrator активно реализует проекты по всей России, среди наших заказчиков – ведущие системообразующие финансовые, телеком и ритейл компании страны.Центральный офис Bell Integrator расположен в Москве, представительства – в Санкт-Петербурге, Нижнем Новгороде, Пензе, Саратове, Уфе, Барнауле, Минске (Беларусь). Сейчас мы находимся в поиске аналитика данных на проект крупного банка. На этой позиции вы сможете:· Получить опыт работы в компании из TOP-3· Принять участие в проектах, связанных с потоковой и пакетной обработкой данных, проектировании AI агентов· Расширить свой опыт использования современных инструментов· Поработать в команде профессионалов, у которых есть чему поучиться· Получить новые знания на внутренних и внешних тренингах Обязанности:  Участие в полном производственном цикле Формализация и согласование тех.требований и solution архитектуры в заданные сроки Участие в цикле тестирования и приемо-сдаточных испытания Взаимодействие со смежными командами   Требования:  ​​​​​​​Опыт работы в крупной компании от 2-х лет Знание SQL Знание одной или несколько технологий: Java Spring, Apache Spark, Kafka, Postgres Знание принципов построения современной ИТ-архитектуры Опыт участия в проектах и задачах, связанных с выводом решений в промышленную эксплуатацию Понимание как работают высоконагруженные сервисы.  Условия:​​​​​​​  достойный уровень заработной платы (по итогам технического интервью) работа в аккредитованной IT компании сотрудничество: ТК РФ, ИП, ГПХ ДМС, расширенные возможности стандартного социального пакета корпоративный абонемент на фитнес и курсы английского языка командная работа по гибким методологиям реферальная система «Приведи друга – получи бонус» офисный формат работы."
