id,name,area,experience,key_skills,description
128551819,Lead Data Scientist (Сахалин),Казань,Более 6 лет,,"Сахалинский центр искусственного интеллекта ищет талантливого и амбициозного исследователя данных (Senior Data Scientist) для работы над проектами в области искусственного интеллекта. Вам предстоит участвовать в прикладных исследованиях, разработке и внедрении моделей машинного обучения, а также взаимодействовать с командой и внешними партнерами для решения сложных задач!!!!Только ПЕЕРЕЗД в г. Южно-Сахалинск, Сахалинская область!!!НЕ удаленная работа!!! Индивидуальное сопровождение при переезде кандидата и членов его семьи:  Возмещение перелета; Возмещение аренды жилья; Помощь в трудоустройстве супруги/ супруга; Устройство детей в детские сады и школы;  Требования:  Высшее образование в области: математики/ информатики/ физики или смежных дисциплин; Не менее 5 лет в Data Science, включая 3 года на руководящих позициях; Реализация проектов с SOTA-архитектурами (Transformers, GAN, LLM); Опыт работы с MLOps (Docker, Kubernetes, Airflow); Навыки работы с Python и библиотеками: PyTorch, TensorFlow, OpenCV, Scikit-learn, Pandas, NumPy; Опыт работы с базами данных (SQL, NoSQL), облачными платформами (AWS, Azure) и MLOps-практиками; Знание методов обработки данных с БПЛА (геопривязка, ортофотопланы) и временных рядов (ARIMA/SARIMA/SARIMAX, Prophet); Английский язык: на уровне чтения технической документации; Понимание этических аспектов ИИ и работы с персональными данными. Обязанности: Лидерство и управление:  Руководство командой Data Science (до 7 человек), менторство Middle/Junior-специалистов; Участие в подборе персонала, формировании KPI команды и стратегическом планировании проектов.Исследования и разработка: Разработка и внедрение моделей ИИ (CNN, Transformers, GAN, LLM) для задач CV, NLP и временных рядов; Интеграция решений в клиент-серверные архитектуры (опыт Software Engineering); Участие в Kaggle и аналогичных соревнованиях (цель — топ-30%).Проектная деятельность: Трансформация бизнес-задач заказчиков в технические требования; Участие в рабочих группах по регулированию ИИ (GDPR, этические стандарты).Научная деятельность: Публикация статей в журналах Q1-Q2, подача заявок на гранты (РНФ, РФФИ); Представление СЦИИ на конференциях и сотрудничество с вузами/исследовательскими центрами.Условия: Трудоустройство по ТК РФ, полный соц. пакет;  График работы: Пн-Пт;   Ежегодный оплачиваемый отпуск 44 дня;   Оплата проезда в отпуск раз в два года.​​​​​​​​​​​​​;"
128542442,Data Scientist (Sberspace),Москва,От 3 до 6 лет,,"Команда Sberspace ищет Data Scientist для работы над проектом по созданию поискового AI-ассистента, который поможет разработчикам, владельцам продуктов и другим специалистам в области разработки программного обеспечения в Сбере. Тебе предстоит:  генерировать новые гипотезы и идеи по улучшению работы AI-ассистента. тестировать гипотезы и проводить эксперименты (подготовка данных для проверки, проведение эксперимента, отслеживание качества метрик, предложение применения улучшений на практике). использовать и обучать модели, например, модель классификации поисковых запросов. заниматься промт-инжинирингом.  Мы ожидаем:  опыт вывода AI систем в ПРОД (Classic ML, RAG, Agents) опыт оценки работы AI систем и повышения ее качества знание классического ML и NLP (NER, классификация, суммаризация, кластеризация, ранжирование, рекомендации) знание архитектур нейронных сетей: RNN, LSTM, трансформеры. знание фреймворков для работы с LLM (LangChain/GigaChain, LangServe/GigaServe, LlamaIndex и др.). понимание принципов и основ обучения языковых моделей. понимание алгоритмов индексации и поисковых решений навыки работы с генеративными AI-моделями; опыт создания AI-агентов и использования их в работе будет преимуществом опыт использования GigaChat, Kandinsky и аналогов в продуктах, навыки создания и использования AI-агентов инструментальное владение AI для анализа, генерации и автоматизации.  Будет плюсом:  знание Elastic Search/Docker/ OpenShift/ Kafka. инструменты DevOps: Git, Bitbucket, Nexus, Jenkins.  Мы предлагаем:  гибридный формат работы( годовой бонус и ежегодный пересмотр зарплаты статус аккредитованной ИТ-компании со всеми преимуществами расширенный ДМС с первого дня и льготное страхование для семьи корпоративный университет Сбера, внутренняя образовательная платформа, участие в IT-конференциях офис с видом на набережную, зонами отдыха и спортзалом 90 дней удаленной работы льготная ипотека в Сбере, подписка СберПрайм+, скидки от партнеров и сервисов группы компаний."
128523253,Data scientist Middle+,Москва,От 1 года до 3 лет,,"В продуктовую команду внедрения и развития искусственного интеллекта в сфере EdTech в СБЕРе ищем выдающегося Data Scientist/ML Engineer. Тебе предстоит заниматься разработкой ML-пайплайнов и AI-систем с использованием передовых технологий AI: NLP, LLM, MLLM, RAG, AI-агентов и мультиагентных систем в частности на базе флагманской модели СБЕРа – GigaChat. Твоей главной целью в команде с дата-аналитиками и промпт-инженерами и разработчиками будет создание production-систем, способных обрабатывать большие объемы данных разных модальностей и выдавать результаты, нацеленные на эффективное решение бизнес-задач. У тебя есть уникальный шанс принять участие в формировании передовых AI native EdTech решений в команде сильных и амбициозных профессионалов, нацеленных на результат. Обязанности  Оперативная проверка гипотез (Proof of Concept): предобработка данных, подбор, тестирование и дообучение моделей и функционала (например, function calling), подсчет и улучшение метрик, необходимых для решения бизнес-задачи, EDA; Участие в подготовке тестовых и валидационных датасетов, разработка требований к данным, их формату, качеству, структуре, объему, проработка соответствующих методологий разметки, необходимых для качественной отработки AI-систем; Разработка, внедрение, мониторинг и оптимизация ML-пайплайнов и AI-систем, в частности RAG (LLM, cross-encoder, модели ранжирования и т. п.) в том числе для данных разных модальностей (текстов, видео, аудио); Совместно с командой анализ функциональных требований, дизайн решения, проектирование оптимальной функциональной архитектуры реализации; Участие в проработке оптимальных интеграционных сценариев с источниками данных (в том числе разных форматов и модальностей) совместно со смежными командами, отстройка оптимальных ETL-процессов с учетом бизнес-требований.  Требования  Знания Python и библиотек для работы с данными (pandas, numpy, matplotlib, seaborn, pytorch, sklearn, BeautifulSoup и пр.) Знания классических и современных методов работы с текстовыми данными: токенизация, стемминг, лематизация, NER, sentiment analysis, кластеризация, TF-IDF, embeddings; трансформеры (BERT и пр.), LLM, MLLM, и пр. Понимание принципов работы моделей в области распознавания и синтеза речи и генерации изображений; Построение LLM-, RAG-пайплайнов, агентных и мультиагентных систем с применением соответствующих инструментов: LangСhain, GigaChain, LangGraph, function calling, векторные БД, ETL, и пр. Отслеживание тенденций и нововведений, оперативное тестирование новых инструментов для решения прикладных бизнес-задач; Понимание принципов MLOps, участие в процессах выкатки и поддержки разработанных AI-решений в production-среде; Опыт/понимание работы с технологиями: Docker, fastAPI, gRPC, REST и пр.  Будет плюсом:  Понимание тонкостей промпт-инжиниринга и соответствующий опыт; Опыт работы/знание Java; Понимание принципов работы классического ML, рекомендательных систем, CV.  Условия  Гибридный формат работы (современный офис в Москве на Кутузовском проспекте); Льготные ипотечные условия кредитования; Бесплатная подписка СберПрайм+, скидки на продукты компаний-партнеров: Okko, Сбер Маркет, Мега Маркет, Самокат, Еаптека и другие; ДМС с первого дня и скидки на страхование для близких; Корпоративная пенсионная программа; Детский отдых и подарки за счет Компании; Обучение за счет Компании: онлайн курсы, неограниченный доступ к библиотеке и обучение на базе Корпоративного университета тренинги, митапы и возможность получить новую квалификацию;  *Уважаемый соискатель! Обращаем Ваше внимание, что в целях подбора персонала АНО ДПО «Корпоративный университет Сбербанка» привлекает к обработке Вашего резюме Публичное акционерное общество «Сбербанк России», адрес местонахождения: Российская Федерация, 117312, г. Москва, улица Вавилова, 19."
128542283,Data Scientist (Senior),Москва,От 3 до 6 лет,"Python, ML, CI\CD, СУБД, Linux","Основные задачи:  Работа с данными (очистка данных, исследование, feature engineering) Выдвижение и проверка гипотез Обсуждение задачи с бизнес заказчиками Разработка прогнозных моделей машинного обучения на основе табличных данных (прогноз продаж, прогноз кол-ва чеков, ценообразование) Проведение экспериментов, подбор метрик, валидация моделей и мониторинг их качества Доведение моделей до production (согласно CI\CD процессу) Дизайн и проведение A\B тестов  Наши пожелания к знаниям и опыту:   Опыт в ML от 3 лет   Понимание принципа работы основных алгоритмов классического ML (классификации, кластеризации, регрессии, временные ряды)   Уверенное владение основным стеком: python, catboost\lightgbm, sklearn, pandas, numpy   Навыки написания оптимальных sql запросов (оконные функции)   Умение писать хороший код на Python   Умеете строить и проверять гипотезы, объясняющие особенности в данных   Навыки ведения совместной разработки (gitlab, ci\cd)   Опыт работы с моделями временных рядов   Опыт работы с распределенными СУБД (Greenplum, Arenadata Db)   Опыт работы с airflow/mlflow/dvc   Опыт ведения документации своих проектов, ведение задач в таск-трекере   Опыт проведения A/B тестов   Опыт работы с Linux   Мы предлагаем:   Достойный уровень оплаты труда   Продвинутую систему бенефитов   5-ю дополнительную неделю отпуска после 3-го года работы   Профессиональное развитие и карьерный рост  Работу в масштабном бренде с уникальной историей Оформление в аккредитованную ИТ компанию ГИБРИДНЫЙ формат работы"
128529230,"Middle Data Scientist в команду ""Разработка AI-решений БСР""",Москва,От 1 года до 3 лет,,"Описание команды: Мы разрабатываем AI-агентов для продуктовых команд и ТОП-процессов Блока ""Стратегия и развитие"", совмещая Classic NLP, LLM-based и мультиагентные подходы с целью повышения внутренней эффективности и автономизации задач на основе Leading Edge технологий в области AI. Основные направления деятельности:  Мэтчим разные сущности банка (продукты, функции, цели, встречи, письма, задачи Jira и др.) для создания полной картины в рамках анализа эффективности всей организации Формируем рекомендации по повышению эффективности на основе классификации, кластеризации и тематического моделирования с использованием цифровых следов Реализуем пайплайны обработки внутренних документов произвольной длины для максимального ускорения работы с ними (маршрутизация, рекомендация замечаний и генерация корректных документов с нуля) Проводим анализ графов целей организации (связанность, каскадирование, полнота и актуальность) для выравнивания стратегии банка на всех уровнях, а также рекомендуем амбициозные цели с учетом контекста и приоритетов стратегии Расширяем направление доменной адаптации для прокачивания стримов семантического поиска, ранжирования и прочих NLP downstream-задач Участвуем в развитии глобального направления AI-агентов и регулярно используем в работе современные подходы на основе LLM (External Tools, Reasoning, Reflection) Проверяем гипотезы любой сложности для получения Data-driven инсайтов, которые становятся предметом обсуждения на стратегических сессиях руководства банка  В наши глобальные планы входит:  Разработка и внедрение AI-агентов для самых приоритетных стратегических процессов банка с потенциалом переиспользования на внешнем рынке Создание SotA-решений с учетом специфики банка  Почему стоит присоединиться к нам: Почему стоит присоединиться к нам:  Возможность использовать передовые AI-технологии и платформы банка Участие в развитии инновационных сервисов стратегического блока, которые приносят реальную пользу процессам и продуктам всего банка, при этом быстро попадают в поле зрения ключевых руководителей Возможность участия в международных проектах и конференциях по AI и ML Работа в дружной команде профессионалов, ориентированной на достижение самых амбициозных целей и постоянное развитие  Обязанности  Разработка и внедрение ML-моделей и AI-агентов от этапа MVP до ПРОМ (CRISP-DM) Решение задач NLP: Preprocessing, Classification, Summarization (Ext/Abst), Sentence Compression, Simplification, NER, Semantic Search, Clustering и др. Создание мультиагентных пайплайнов на основе фреймворков для работы с LLM (LangChain/GigaChain) Адаптация и обучение языковых моделей (LLM) Сбера на основе внутренних и внешних данных (In-Context Learning, Prompt Tuning, RAG, PEFT) Индексация и ранжирование текстовых документов разной длины Взаимодействие с бизнес-заказчиком для выявления требований и самостоятельная постановка задач Определение ML SysDes решения с учетом разрешенного технологического стека Участие в валидации и автомониторинге моделей, проведение A/B тестирования  Требования  образование в техническом ВУЗе в сфере компьютерных наук, прикладной математики или статистики. Наиболее приоритетны: ВШЭ, МФТИ, МГУ, МИФИ опыт в разработке NLP моделей понимание жизненного цикла моделей (CRISP-DM) умение переводить бизнес-постановку задачи в ML-постановку, грамотная интерпретация полученных результатов свободное владение базовыми библиотеками на Python: pandas, numpy, matplotlib, seaborn и др. WEB-фреймворки: FastAPI (async methods), Flask и др. знание архитектур нейронных сетей: RNN, LSTM, трансформеры (BERT, BART, T5) знание фреймворков для работы с LLM (LangChain/GigaChain, LangServe/GigaServe, LlamaIndex и др.)  Условия  Ипотека выгоднее на 7% для каждого сотрудника и льготные условия кредитования Возможность выбрать удобный формат работы - гибрид, удаленка или офис Бесплатная подписка СберПрайм+ Скидки на продукты компаний-партнеров ДМС с первого дня и льготное страхование для близких Корпоративная пенсионная программа Обучение за счет компании: онлайн курсы в онлайн-школе Сбера и неограниченный доступ к библиотеке, обучение в Корпоративном университете, тренинги, митапы и возможность получить новую квалификацию Крупнейшее DS&AI community – более 600 DS банка, регулярный обмен знаниями, опытом и лучшими практиками, интерактивные лекции и мастер-классы от ведущих ВУЗов и экспертов технологических компаний, дайджест о самых последних разработках в области DS&AI и отчеты с крупнейших конференций мира, регулярные внутренние митапы"
