id,name,area,experience,key_skills,description
127367652,Аналитик данных (data-analyst + BI-analyst) в службу бизнес аналитики и планирования,Москва,От 1 года до 3 лет,SQL,"Обязанности:  сбор, обработка и анализ данных из разных источников, подготовка выгрузок с помощью SQL-скриптов по выставленным бизнес-требованиям; аd-hoc аналитика по запросу для быстрого принятия решений; оптимизация запросов на SQL для эффективного получения данных; создание и поддержка отчетов и дашбордов в BI-системах (например, Power BI, PixBI); поиск источников данных, исследование и анализ больших объемов данных, выявление выбросов и неочевидных зависимостей; участие в разработке и внедрении аналитических процессов; обеспечение качества данных, включая формирование требований к качеству, мониторинг, анализ, коммуникация со смежными подразделениями для устранения причин и следствий проблем; участие в разработке и внедрении аналитических процессов; помощь команде в принятии data driven решений.  Требования:  опыт работы от 1-го года на позициях, связанных с обработкой и анализом данных; уверенное знание SQL для работы с большими массивами данных в промышленной БД (Oracle, MSSQL, PostgreSQL, Teradata); опыт работы с BI-инструментами (Power BI, Tableau, PixBI или аналогичные); продвинутый пользователей Microsoft Office (Excel); базовое понимание основных банковских продуктов и процессов; опыт работы со Spark и знание Python будет преимуществом ."
127371825,Младший DATA-аналитик/Аналитик данных (Junior),Нижний Новгород,От 1 года до 3 лет,"MS PowerPoint, Подготовка презентаций, Power BI, Дашборд, MS Excel, T-SQL (база данных MS SQL)","Мы растём и всё больше решений принимаем на данных.Нам нужен дата-аналитик, который поможет превратить цифры в понятные истории для бизнеса, автоматизировать отчётность и навести порядок в потоках данных.Ты будешь работать рядом с коллегами, которые ценят точность, логику и здоровое любопытство. Что предстоит делать:   Настраивать автоматическую отчётность и следить за её актуальностью.   Выполнять ежедневные и еженедельные задачи по шаблону.   Поддерживать текущую структуру данных в рабочем состоянии.   Собирать, преобразовывать и обогащать данные из разных источников.   Согласовывать и реализовывать основные метрики с бизнес-заказчиками.   Создавать систему мониторинга и проверять корректность данных.   Работать с большими объёмами данных, организовывать их хранение и обработку.   Вести документацию по проектам в Confluence.   Что важно знать и уметь:   Python (pandas, requests, библиотеки для работы с SQL).   Уверенно владеть T-SQL (MS SQL): писать хранимые процедуры, функции, триггеры.   Понимать логику ETL-процессов (извлечение, преобразование, загрузка, автоматизация).   Желателен опыт работы с Power BI и знание DAX.   Уверенно работать в Excel.   Мы предлагаем:   Материальную поддержку в сложных жизненных ситуациях.   Ноутбук и сим-карту для комфортной работы.   Гибридный или удалённый формат с командировками в центральный офис (1 неделя раз в квартал).   Заработную плату, обсуждаемую индивидуально по итогам собеседования.   Рост и развитие: участие в проектах по BI и автоматизации, обучение внутри компании.   Команду профессионалов, у которых можно учиться и на которых можно положиться.   Стабильность крупной компании, где ценят данные, инициативу и здравый смысл.   Если к резюме ты добавишь пару строк о себе — не по шаблону, а по-настоящему, — ты точно выделишься.И, возможно, уже завтра будешь обсуждать с нашим HRD, как превратить данные в сильные решения. Присоединяйся к нам — здесь цифры обретают смысл."
127409410,Data Scientist,Петрозаводск,От 1 года до 3 лет,,"ООО «К-Скай» – российская IT компания, резидент Фонда «Сколково», лидер российского рынка искусственного интеллекта для здравоохранения, разработчик платформы прогнозной аналитики Webiomed. Компания входит в государственный реестр аккредитованных IT-компаний Министерства цифрового развития, связи и массовых коммуникаций РФ, является участником Хелснет НТИ и членом Ассоциации: АРПП отечественный софт, Ассоциация лабораторий по развитию искусственного интеллекта (АЛРИИ), Национальная база медицинских знаний (НБМЗ). Компания входит в ТОП -100 HealthTech компаний рейтинга RB Choice. Основными задачами компании ООО «К-Скай» являются инновационные разработки и научные исследования в сфере искусственного интеллекта для клинической медицины и здравоохранения. Заказчиками компании являются государственные и коммерческие медицинские организации, научно-исследовательские центры и фарм-компании. Продукт компании – это платформа прогнозной аналитики Webiomed. Решение предназначено для автоматического анализа медицинских данных с целью оценки рисков развития заболеваний и их осложнений на персональном и популяционном уровне. Платформа использует технологии интеллектуальных методов обработки больших данных, таких как машинное обучение, NLP-технологии, прогнозное моделирование и т.д. В состав решения включена система поддержки принятия управленческих решений в области профилактики и управления здоровьем, а также система поддержки принятия врачебных решений (СППВР). Значимость разработки состоит в способности существенно сократить предотвратимую заболеваемость и смертность, особенно у пациентов с хроническими заболеваниями, путем интеллектуального анализа данных и поддержки принятия клинических и управленческих решений, что является крайне важной национальной и социальной задачей. Кого мы ищем: Data Scientist Как Data Scientist в компании К-Скай, Вы будете работать в нашем продукте - Webiomed. Мы предложим интересные и сложные задачи с возможностью проявить себя в дружелюбной атмосфере. Сможете реализовать свои идеи, которые помогут миллионам людей по всей стране. Что нужно делать   Разработка диагностических и прогностических моделей для интеллектуальной системы поддержки врачебных решений.   Подготовка технических заданий на формирование наборов данных для построения и валидации моделей.   Выбор и обоснование технологий для машинного обучения и последующей интеграции моделей в продукты.   Валидация, оценка качества и интерпретируемость созданных моделей.   Работа с Large Language Models (LLM) для обработки неструктурированных текстовых данных в рамках медицинских задач.   Участие в научно-исследовательской деятельности компании в коллаборации с медицинскими экспертами.   Что мы ценим   Высшее образование (техническое, математическое или медицинское).   Опыт работы на позиции Data Scientist / Data Analyst от 1 года.   Понимание принципов работы классических ML-алгоритмов и архитектур нейронных сетей.   Глубокие знания в области обработки сложных данных: работа с пропусками, временными рядами, дисбалансом классов.   Практический опыт работы с фреймворками и библиотеками: pandas, scikit-learn, PyTorch, XGBoost/LightGBM.   Понимание метрик качества и методов валидации моделей, владение техниками интерпретации их результатов.   Интерес к сфере здравоохранения и медицинской тематике.   Приветствуется:   Наличие научных публикаций в области Data Science или смежных дисциплин.   Участие в соревнованиях по машинному обучению (Kaggle и аналоги).   Понимание архитектуры LLM и опыт их применения для решения практических бизнес-задач.   Мы предлагаем   Достойная профессионального уровня зарплата, размер обсудим на собеседовании;   Возможность работать полностью удалённо;   Поддержка профессионального роста, составление индивидуальных траекторий развития, поддержка и обратная связь   Возможность участие в профильных конференциях в качестве докладчика    Мы поможем быстро освоиться на новом месте, погрузиться в проект и войти в рабочий процесс!"
127401542,Data Scientist,Москва,От 1 года до 3 лет,"Python, PyTorch, Numpy, pandas, MNE-Python, ЭЭГ, Айтрекинг, обработка сигналов, Машинное обучение, Визуализация данных, Matplotlib, Jupyter Notebook","О проекте:«Нейроллаб» — исследовательская нейромаркетинговая лаборатория, которая изучает реакции пользователей на цифровой контент (реклама, интерфейсы, визуалы) с помощью айтрекинга, биометрии и нейрооборудования. Результаты исследований конвертируются в инсайты и рекомендации для бизнеса. Лаборатория также ведёт научную и образовательную активность (стажировки, проекты). Что предстоит делать:   Предобработка психофизиологических данных (айтрекинг, биометрия, ЭЭГ): очистка, выравнивание, синхронизация потоков данных.   Анализ экспериментальных данных: статистический анализ, извлечение метрик вовлечённости, корреляции, кластеризация, тестирование гипотез.   Объединение и усреднение данных айтрекинга, биометрии и ЭЭГ (скрипты/пайплайны).   Визуализация: тепловые карты взгляда, графики вызванных потенциалов (ERP), временные ряды, агрегированные дашборды и графики для отчётов.   Поддержка и доработка существующих Python-инструментов (рефакторинг, модульность, тесты, документация).   Разработка и прототипирование ML/DL-моделей для распознавания/прогнозирования состояний (по необходимости).   Подготовка отчётной документации и готовых аналитических артефактов для клиентов и внутренней команды.   Проведение технического обучения сотрудников лаборатории по использованию разработанных инструментов.   Участие в научной деятельности: помощь в оформлении методологии, подготовке статей/презентаций (по задачам проекта).   Что мы ждём:   Уверенный Python: numpy, pandas, scipy, matplotlib / plotly.   Опыт работы с PyTorch (или другим DL-фреймворком).   Базовые знания линейной алгебры, математической статистики и цифровой обработки сигналов (DSP).   Опыт работы с сигналами/временными рядами (ЭЭГ, биометрия или аналогичные физиологические данные).   Навыки предобработки и синхронизации мультимодальных потоков данных (айтрекер + биометрия + ЭЭГ).   Опыт визуализации исследовательских данных (групповые и индивидуальные графики, тепловые карты, ERP).   Умение составлять понятную документацию и формировать отчёты для заказчика.   Навыки исследовательской/научной работы (проектирование экспериментов, статистический анализ).   Будет плюсом:   Опыт с библиотеками для ЭЭГ/нейрофизиологии: MNE-python, NeuroKit2 и т.п.   Опыт с R / SPSS.   Опыт работы с системами айтрекинга (Tobii, iMotions и/или их экспорт-форматами).   Опыт создания дашбордов (Dash, Streamlit, Tableau / PowerBI).   Опыт обучения сотрудников и подготовки методических материалов.   Опыт DevOps для моделей (docker, CI/CD) — желателен, но не обязателен.   Опыт работы в научной лаборатории или коммерческих нейро/UX-исследованиях.   Наличие практических проектов (портфолио, GitHub, научные работы, кейсы).   Что мы предлагаем:   Официальное трудоустройство — оформление по ТК РФ в IT - аккредитованную компанию.   Полностью удалённый формат работы.   Частичная занятость: до 20 часов в неделю (возможность совмещения с учёбой/работой при согласованном графике).   Рост и развитие:   Включение в проект с возможностью участия как в коммерческих, так и в научных треках.   Кураторы: руководитель проекта и технический тимлид.   Социальный пакет:   ДМС.   Оплачиваемый отпуск 28 дней в году.   Оплачиваемые больничные."
