id,name,area,experience,key_skills,description
127405933,Data Scientist,Москва,От 3 до 6 лет,,"Мы - компания Outtech, внедряем и разрабатывает ПО. Работаем с сегментом крупного бизнеса, поэтому все наши проекты - большие, амбициозные и интересные :) Ищем Data Scientist с опытом от 3 лет. Проект - финтех. Грейд: Senior/ Middle+ Обязанности:   Работа с TF-IDF, BM25 и нейросетевыми энкодерами (BERT, BGE, E5);   Интеграция с Keycloak, понимание OAuth2/OpenID Connect, настройка Realm’ов и клиентов;   Понимание микросервисного подхода, REST/gRPC-интерфейсов, межсервисных очередей (RabbitMQ/Kafka — плюс);   Мониторинг и логирование (Prometheus, Grafana, Sentry).   Требования:   Опыт с библиотеками PyTorch, работа с LLM через API, знание NLP-стека;   Уверенный Python, опыт с FastAPI, знакомство с asyncio;   Docker, (Kubernetes будет плюсом), Git, CI/CD-системы;   PostgreSQL, pgvector или аналогичные расширения для векторного поиска.   Условия:   Полностью удаленная работа  Разные форматы оформления отношений: ТК, ИП, СЗ. Оборудование для работы Ротация в рамках проектов"
127292035,Data Analyst Engineer (Middle),Москва,От 3 до 6 лет,,"Мы IT-FINANCE - команда крутых специалистов, которые разрабатывают программное обеспечение для лидогенерации и fintech компаний. Сейчас мы находимся в поисках опытного Data Analyst, который усилит нашу команду. Если ты стремишься к профессиональному развитию в среде опытных и проактивных коллег, смело осталяй свой отклик! Чем предстоит заниматься:   Взаимодействие с продуктовой и аналитической командами для настройки метрик и автоматизации отчётности;   Проектирование и развитие аналитических витрин (Data Marts) для бизнеса и продуктовых команд;   Разработка, оптимизация и поддержка SQL- и dbt-моделей;   Настройка и сопровождение ETL/ELT-процессов совместно с Data Engineers;   Интеграция данных из различных источников: DWH, CRM, CDC, clickstream   Работа с хранилищами данных (Greenplum, S3);   Оптимизация производительности запросов и процессов загрузки данных;   Разработка и внедрение проверок качества данных и тестов в dbt, поддержка корректности данных в аналитических витринах и отчётах;   Подготовка дата-сетов для моделей машинного обучения и исследований;   Участие в развитии архитектуры DWH и внедрении лучших практик;  Ведение задач в трекере, своевременное докладывание о статусах процессов и их изменение     Что мы ожидаем от будущего коллеги:   Опыт работы с данными от 3 лет — в аналитике, DWH или BI-направлениях;   Понимание юнит-экономики трафика (AR, CTR, EPC, EPV) и финансовых метрик (ROI);   Умение формулировать аналитические гипотезы и доносить выводы до бизнеса понятным языком;   Отличное знание SQL (CTE, оконные функции, join’ы, оптимизация запросов под большие объёмы данных);   Опыт работы с Greenplum или другими клоночными и MPP-СУБД (ClickHouse, BigQuery, Snowflake, Redshift и др.);   Понимание архитектуры DWH и принципов построения слоёв данных;   Опыт работы с dbt (моделирование, тестирование, документация);   Навыки настройки и мониторинга пайплайнов в Airflow;   Опыт работы с объектными хранилищами;   Владение Python (pandas, numpy, airflow operators) для автоматизации и проверки данных;  Умение структурировать задачи, документировать решения и взаимодействовать с инженерными командами     Будет плюсом:   Опыт работы с CDC-процессами, Kafka или потоковой обработкой данных;   Опыт построения систем контроля качества данных;   Знание принципов data governance, data lineage, metadata management;   Знание Trino / Presto для построения federated-запросов и интеграции данных;   Опыт системного анализа при интеграции данных из внешних источников;  Понимание A/B-тестирования, статистических методов анализа и методов машинного обучения  Что мы предлагаем:  Достойный уровень заработной платы, включающий ежегодную индексацию; Гибкий подход оформлению сотрудничества (ТК, ГПХ); Льготы IT аккредитованной компании;  Полностью удаленная работа (нам не важно в каком городе или в какой стране ты будешь находиться);   Гибкий график, а также у нас стандартная пятидневная рабочая неделя;   Корпоративное оборудование;   ДМС со стоматологией и телемедициной, профессиональной психологической поддержкой и др.;   Компенсация внешнего обучения за счет компании;  Работа в коллективе крутых специалистов в сфере IT и FinTech, а также дружественная атмосфера без лишних формальностей;  Крутые корпоративы 2 раза в год, в т.ч. для удаленных сотрудников."
127408796,Senior Data Scientist (команда Applied ML Research),Москва,От 3 до 6 лет,"Python, Spark","Мы запустили R&D-лабораторию машинного обучения, где объединяем исследовательские подходы и реальные продуктовые задачи ритейла. У нас уже сформирована первичная команда Optimization & Science Lab, которая фокусируется на на задачах оптимизации. Сейчас мы усиливаем команду Applied ML Research. ⚡ Applied ML Research Команда для тех, кто решает самые сложные прикладные задачи, где нет готовых подходов — нужно исследовать, изобретать и проверять гипотезы. Мы ищем исследователей, которые умеют превращать эксперименты в работающие решения и понимают, как довести R&D до PoC. Мы ищем специалистов с опытом в unsupervised- и semi-supervised-обучении, deep learning для табличных данных, экспериментальном подходе к ML. Чем предстоит заниматься  Решать прикладные ML-задачи повышенной сложности, где нет готовых решений — от кластеризации до нейросетей на табличных данных. Проводить эксперименты и обосновывать выбор подходов — от классических ML-методов до современных архитектур (TabTransformer, Active Learning, Semi-Supervised). Работать с большими, неполными и шумными данными, проектировать фичи, стабилизировать и валидировать сигналы. Проверять гипотезы и строить PoC, помогать в передаче решений в прод. Участвовать в развитии ML-бренда Magnit Tech — выступления, статьи, участие в отраслевых конференциях (ODS, Highload, Матемаркетинг).  Стек: python, spark, airflow, hadoop, sql, git Что нужно, чтобы к нам присоединиться  Опыт работы от 3х лет Опыт применения ML в продакшене: от постановки задачи до валидации результатов. Понимание продвинутых методов машинного обучения и анализа данных (кластеризация, аномалии, Active Learning, Transfer Learning). Умение находить и проверять гипотезы в условиях высокой неопределённости. Уверенное владение Python, SQL, Spark, Airflow, Git. Приветствуется: публикации, open-source активность, участие в индустриальных конференциях."
127362841,"Middle Data Scientist, NLP, Ozon Банк",Москва,От 1 года до 3 лет,Data Science,"Ozon Банк — компания, в которой тесно переплетаются финансы и IT. Мы создаём новые для рынка продукты и сервисы для физических и юридических лиц. Гордимся атмосферой в командах: каждый сотрудник может влиять на процессы и пути к результату. Сейчас мы ищем middle NLP DS в команду, которая занимается всеми NLP-задачами в компании. Мы создаём RAG для различных бизнес-направлений, чат-бот поддержки, реализуем speech-to-text решения, OCR с использованием LLM, кодогенерацию. А также работаем с любыми другими запросами от бизнеса, связанными с текстовыми данными. Модели напрямую влияют на доходность компании и определяют итоговую прибыль. Мы развиваем мощности нашего ЦОД для прикладных и исследовательских задач и самостоятельно прорабатываем и запускаем решения в прод. Наш стек: Vertica, PostgreSQL, Clickhouse, Labelstudio, pytorch + accelerate, tritonserver в k8s, QDrant, Elasticsearch, Langchain Вам предстоит: – Активно участвовать во всех проектах команды – Решать задачи для чат-бота поддержки – На первом этапе использовать модели для поддержки операторов (суммаризация, парафраз, RAG), затем — переходить к полной автоматизации с помощью LLM – Развивать вместе с командой STT- и TTS-направления для обработки звонков Мы ожидаем: – Опыт работы в Data Science от 2 лет – Умение внятно излагать мысли и представлять результаты своей работы – Уверенный Python, умение разбираться в чужом коде – Понимание основных принципов, алгоритмов и метрик классического ML – Опыт решения бизнес-задач с использованием классических и трансформерных NLP-моделей – Понимание, какая NLP-модель для каких случаев подойдёт лучше – LLM — понимание принципов работы, а также ограничений в применении тех или иных моделей Будет плюсом: - Навыки prompt engineering-а и использования structured outputs и function calling у моделей – Потенциально будем разворачивать агентские системы, поэтому будет плюсом опыт работы с такими фреймворками — например, smolagents – Опыт деплоя трансформерных моделей с использованием какого-либо фреймворка: vllm, sglang – Понимание того, как работает в таких фрейворках обработка запросов и как её можно ускорить – Опыт с tritonserver и tensorrt-LLM"
127383480,"Data Scientist, Anti-Fraud, Ozon Bank",Москва,От 3 до 6 лет,Data Science,"Ozon Банк — это подразделение Ozon, где тесно переплетаются финансы и IT. Мы создаём инновационные продукты и сервисы для физических и юридических лиц. Гордимся атмосферой в командах: каждый сотрудник может влиять на процессы и результаты. Мы ищем опытного Data Scientist в команду антифрода Ozon Банк. Наша миссия — защищать пользователей от мошенничества. Опираясь на передовые инструменты аналитики, мощную инфраструктуру и машинное обучение, мы делаем наши продукты удобнее и безопаснее. Вам предстоит: Анализ больших объёмов данных для обнаружения аномалий и паттернов мошенничества; Участие в создании сервисов — реалтайм ML-моделей и правил-эвристик — для выявления мошеннической активности; Сотрудничество с кросс-функциональными командами для повышения безопасности и удобства продуктов; Автоматизация процессов обработки и анализа данных; Мы ожидаем: Опыт работы в Data Science от 2 лет; Уверенное владение Python и библиотеками для анализа данных и машинного обучения; Глубокое понимание алгоритмов машинного обучения и опыт их применения на практике; Отличные знания SQL, умение писать сложные запросы, включая оконные функции; Преимуществом будет опыт построения realtime моделей и их интеграции в продукты. Умение работать данными и видеть закономерности и людей за ними Преимуществом будет опыт работы в антифроде Навыки работы с инструментами визуализации данных; Гибкость в работе и умение быстро переключаться между задачами;"
127325133,Senior Data-аналитик/Аналитик данных,Санкт-Петербург,Более 6 лет,"SQL, PostgreSQL, Python, pandas, Clickhouse, Greenplum, А/В тесты, B2C исследования, Switchback, Geo A/B, Matplotlib","Привет! Мы — аккредитованная IT-компания Maxim Technology. Занимаемся разработкой платформы для пассажирских и грузовых поездок. Самый крупный из наших заказчиков — сервис Maxim. Мы первыми начали менять рынок поездок, создав для Maxim цифровую платформу для связи пассажира и водителя раньше Uber и Gett. Сегодня наша команда работает над высоконагруженными сервисами — в сутки платформа обрабатывает более миллиона заказов. Наше ПО — лидер рынка в регионах России, и мы не собираемся останавливаться на достигнутом! Наша команда растёт быстрыми темпами, и сейчас в штате более 450 IT-специалистов. Офисы компании располагаются в Кургане, Челябинске, Тюмени, Набережных Челнах, Казани, Екатеринбурге и Санкт-Петербурге, но у нас можно работать и удалённо. Сейчас мы в поиске опытного Data-аналитика уровня Senior, который будет находить и внедрять решения для роста бизнеса и выстроит систему анализа данных, дизайна и анализа экспериментов в одной конкретной доменной области. Мы ищем самостоятельного специалиста с сильными soft skills, который умеет переводить данные в конкретные бизнес-решения и эффективно презентовать результаты своей работы. Основные задачи:- Проектирование, запуск и анализ A/B-тестов (в т. ч. Switchback, Geo A/B), приоритизация гипотез;- Сегментация и кластеризация пользователей, исследование CJM, поиск точек роста;- Прогнозирование ключевых метрик и их влияния на процессы и бизнес-результаты;- Подготовка понятных аналитических записок и презентаций для стейкхолдеров. Мы ожидаем от будущего коллеги:- Опыт работы Data-аналитиком от 3-х лет в направлении B2C;- Глубокие знания статистики;- Опыт проектирования, проведения и анализа A/B тестов, включая Switchback и Geo A/B, а также опыт работы с платформами A/B тестирования;- Умение формулировать и приоритизировать гипотезы, защищать выводы на уровне C-level;- Продвинутый SQL и опыт работы с ClickHouse / Greenplum;- Python (pandas, matplotlib / seaborn) для EDA и автоматизации;- Навыки data-storytelling и визуализации результатов. Что дальше? У нас простой процесс подбора. Тебя ждёт интервью с тимлидом, и после этого мы выходим с оффером. Отправляй свой отклик! Мы тебя ждём."
