id,name,area,experience,key_skills,description
128526639,Middle+/Senior Data Scientist в команду NLP Core,Санкт-Петербург,Более 6 лет,,"Привет! Мы – команда NLP Core, специализируемся на актуализации и сборе данных о компаниях. Работая с неструктурированной и сложной информацией, мы превращаем хаос данных в структурированные и качественные информационные потоки, обеспечивая высокую точность, полноту и актуальность контента в продукте. Наша работа напрямую влияет на качество сервиса и лояльность пользователей. Мы разрабатываем алгоритмические и ML-решения для автоматизации задач, применяя весь спектр инструментов NLP стека: от расстояния Левенштейна и линейных моделей до коммерческих LLM и их локальных аналогов. Мы расширяем команду и ищем NLP-инженера которому интересно работать с большими и сложными наборами данных, развивать ML-решения, структурируя их и приводя в порядок. Какие задачи мы решаем  Добыча данных – умные системы для поиска товаров, контактов, описаний и других данных, связанных с компаниями. Поддержка актуальности информации о компаниях – с помощью данных и моделей проводим валидацию существующей информации о компаниях, добываем новую. Категоризация товаров – автоматическая классификация товаров на основе их описаний и характеристик. Модерация данных – предотвращаем публикацию нежелательных отзывов и товаров в продукте.  Наши ожидания от кандидата  Опыт работы с NLP-задачами 3+ лет. Уверенное владение PyTorch, HF Transformers и основными библиотеками для обработки текста и ML/DL. Глубокое понимание LLM: архитектуры моделей, файнтюнинга, техник улучшения качества генерации. Опыт применения LLM стека:  низкоуровневых решений на vLLM, sglang инструментов для оркустрации и интеграции LangChain, LlamaIndex.   Навыки применения классических, глубоких и LLM моделей. Уверенные навыки разработки на Python и владение Git. Готовность работать на всех этапах разработки: от анализа проблемы и проведения экспериментов до оценки решений и их реализации в виде сервисов.  Будет крутым бонусом  Опыт работы с CI/CD и инфраструктурой: Docker, Gitlab, Kubernetes, Kafka, FastAPI, GRPC. Глубокое знание Python: multiprocessing, asyncio. Навыки интеграции и деплоя ML-моделей в продуктовые серверные приложения. Навыки оптимизации инференса ML/DL-моделей: distillation, pruning, ORT, Triton.  Почему стоит к нам присоединиться  Сложные задачи в реальном продукте — сотни тысяч организаций, горы связанных с ними данных разной степени структурированности. Свобода выбирать технологии — мы используем как классические алгоритмы так и передовые ML решения. Влияние на продукт — разрабатываемые нами решения улучшают пользовательский опыт в продуктах компании. Сильная команда — с которой можно расти и умножать свои знания, принося общий вклад. Фокус на исследования — в первую очередь мы занимаемся поиском оптимальных подходов по качеству и производительности.  Почему у нас классно  2ГИС – аккредитованная IT-компания. Можно работать удалённо. Для нас важен специалист, а не его локация. Если хочешь работать в гибридном формате, есть офисы в Москве, Санкт-Петербурге, два классных офиса в Новосибирске. А также коворкинги в Нижнем Новгороде, Томске, Астане, Алма-Ате. Само собой, полностью белая зарплата. Заботимся о здоровье: ДМС и возможность получать онлайн-консультации и терапевта, невролога, психолога и медицинского агента. Если хочешь делиться своим опытом, мы только за — поможем с выступлениями на конференциях и статьями для Хабра/VC. Есть собственный учебный центр: курсы, тренинги и книги для прокачки скиллов."
128529689,"Senior NLP, LLM Data Scientist",Москва,От 3 до 6 лет,,"Кластер моделирования и исследования данных Блока «Стратегия и развитие» Сбера занимается разработкой AI-решений для различных бизнес-доменов подразделения: целеполагание и эффективность деятельности, управление численностью Группы, Data-driven инсайты для стратегии, анализ процессов и клиентских путей банка. Обязанности Обязанности  участие в автоматизации источников данных для ML моделей совместно с ML Engineer/Data Engineer; end2end-разработка ML-моделей, доведение моделей из стадии MVP до целевого решения (все этапы ЖЦ моделей по CRISP-DM от Data Understanding до Deployment с использованием тех. стека банка); NLP-задачи: Preprocessing, Classification, Summarization (Ext/Abst), Sentence Compression, Simplification, NER, Semantic Search, Clustering и др.; Domain Adaptation и дообучение (Lora SFT / SFT) большой языковой модели Сбера (GigaChat) с использованием внутренних / синтетических данных; LLM Plugins (multi-hop reasoning, поиск, генерация fuse blocks для вызова внешних API); разработка Python back-end сервисов для обслуживания моделей в ПРОМ-среде.Сопутствующие обязательные стримы: взаимодействие с бизнес-заказчиком для выявления требований к AI-компоненте продукта; участие в разработке архитектуры решения в части AI-компоненты (тех. стек для развертывания моделей в средах исполнения); участие в стримах по валидации моделей и постановке их на автомониторинг  Требования · опыт в разработке NLP-моделей (обязательно) и рекомендательных систем (желательно); · высокий уровень владения ядром Python и SQL; · свободное владение базовыми библиотеками на Python, в том числе: pandas, numpy, matplotlib, seaborn; · опыт работы с NLP-библиотеками: pymorphy2, NLTK, Gensim, spaCy, regexp; · индустриальный опыт разработки, обучения, тестирования, выведения моделей в эксплуатацию и мониторинга качества; Условия  возможен удаленный, гибридный или офисный формат на выбор ипотека выгоднее для каждого сотрудника и льготные условия кредитования фитнес залы в офисах; бесплатная подписка СберПрайм+; скидки на продукты компаний-партнеров: Okko, Сбер Маркет, Delivery Club, Самокат, Сбер Еаптека и другие; ДМС с первого дня и льготное страхование для близких;корпоративная пенсионная программа; курсы для будущих родителей, материальная поддержка и тематическое сообщество для молодых мам; детский отдых и подарки за счет Компании; обучение за счет Компании: онлайн курсы в Виртуальной школе Сбера и неограниченный доступ к библиотеке, обучение в Корпоративном университете, тренинги, митапы и возможность получить новую квалификацию; реферальная программа для сотрудников: можно пригласить в команду знакомых профессионалов и получить вознаграждение до 100 тыс. рублей"
128560197,Senior Data-аналитик/Аналитик данных,Курган,Более 6 лет,"SQL, PostgreSQL, Python, pandas, Clickhouse, Greenplum, А/В тесты, B2C исследования, Switchback, Geo A/B, Matplotlib","Привет! Мы — аккредитованная IT-компания Maxim Technology. Занимаемся разработкой платформы для пассажирских и грузовых поездок. Самый крупный из наших заказчиков — сервис Maxim. Мы первыми начали менять рынок поездок, создав для Maxim цифровую платформу для связи пассажира и водителя раньше Uber и Gett. Сегодня наша команда работает над высоконагруженными сервисами — в сутки платформа обрабатывает более миллиона заказов. Наше ПО — лидер рынка в регионах России, и мы не собираемся останавливаться на достигнутом! Наша команда растёт быстрыми темпами, и сейчас в штате более 450 IT-специалистов. Офисы компании располагаются в Кургане, Челябинске, Тюмени, Набережных Челнах, Казани, Екатеринбурге и Санкт-Петербурге, но у нас можно работать и удалённо. Сейчас мы в поиске опытного Data-аналитика уровня Senior, который будет находить и внедрять решения для роста бизнеса и выстроит систему анализа данных, дизайна и анализа экспериментов в одной конкретной доменной области. Мы ищем самостоятельного специалиста с сильными soft skills, который умеет переводить данные в конкретные бизнес-решения и эффективно презентовать результаты своей работы. Основные задачи:- Проектирование, запуск и анализ A/B-тестов (в т. ч. Switchback, Geo A/B), приоритизация гипотез;- Сегментация и кластеризация пользователей, исследование CJM, поиск точек роста;- Прогнозирование ключевых метрик и их влияния на процессы и бизнес-результаты;- Подготовка понятных аналитических записок и презентаций для стейкхолдеров. Мы ожидаем от будущего коллеги:- Опыт работы Data-аналитиком от 3-х лет в направлении B2C;- Глубокие знания статистики;- Опыт проектирования, проведения и анализа A/B тестов, включая Switchback и Geo A/B, а также опыт работы с платформами A/B тестирования;- Умение формулировать и приоритизировать гипотезы, защищать выводы на уровне C-level;- Продвинутый SQL и опыт работы с ClickHouse / Greenplum;- Python (pandas, matplotlib / seaborn) для EDA и автоматизации;- Навыки data-storytelling и визуализации результатов. Что дальше? У нас простой процесс подбора. Тебя ждёт интервью с тимлидом, и после этого мы выходим с оффером. Отправляй свой отклик! Мы тебя ждём."
128560196,Senior Data-аналитик/Аналитик данных,Казань,Более 6 лет,"SQL, PostgreSQL, Python, pandas, Clickhouse, Greenplum, А/В тесты, B2C исследования, Switchback, Geo A/B, Matplotlib","Привет! Мы — аккредитованная IT-компания Maxim Technology. Занимаемся разработкой платформы для пассажирских и грузовых поездок. Самый крупный из наших заказчиков — сервис Maxim. Мы первыми начали менять рынок поездок, создав для Maxim цифровую платформу для связи пассажира и водителя раньше Uber и Gett. Сегодня наша команда работает над высоконагруженными сервисами — в сутки платформа обрабатывает более миллиона заказов. Наше ПО — лидер рынка в регионах России, и мы не собираемся останавливаться на достигнутом! Наша команда растёт быстрыми темпами, и сейчас в штате более 450 IT-специалистов. Офисы компании располагаются в Кургане, Челябинске, Тюмени, Набережных Челнах, Казани, Екатеринбурге и Санкт-Петербурге, но у нас можно работать и удалённо. Сейчас мы в поиске опытного Data-аналитика уровня Senior, который будет находить и внедрять решения для роста бизнеса и выстроит систему анализа данных, дизайна и анализа экспериментов в одной конкретной доменной области. Мы ищем самостоятельного специалиста с сильными soft skills, который умеет переводить данные в конкретные бизнес-решения и эффективно презентовать результаты своей работы. Основные задачи:- Проектирование, запуск и анализ A/B-тестов (в т. ч. Switchback, Geo A/B), приоритизация гипотез;- Сегментация и кластеризация пользователей, исследование CJM, поиск точек роста;- Прогнозирование ключевых метрик и их влияния на процессы и бизнес-результаты;- Подготовка понятных аналитических записок и презентаций для стейкхолдеров. Мы ожидаем от будущего коллеги:- Опыт работы Data-аналитиком от 3-х лет в направлении B2C;- Глубокие знания статистики;- Опыт проектирования, проведения и анализа A/B тестов, включая Switchback и Geo A/B, а также опыт работы с платформами A/B тестирования;- Умение формулировать и приоритизировать гипотезы, защищать выводы на уровне C-level;- Продвинутый SQL и опыт работы с ClickHouse / Greenplum;- Python (pandas, matplotlib / seaborn) для EDA и автоматизации;- Навыки data-storytelling и визуализации результатов. Что дальше? У нас простой процесс подбора. Тебя ждёт интервью с тимлидом, и после этого мы выходим с оффером. Отправляй свой отклик! Мы тебя ждём."
128551820,Lead Data Scientist (Сахалин),Новосибирск,Более 6 лет,,"Сахалинский центр искусственного интеллекта ищет талантливого и амбициозного исследователя данных (Senior Data Scientist) для работы над проектами в области искусственного интеллекта. Вам предстоит участвовать в прикладных исследованиях, разработке и внедрении моделей машинного обучения, а также взаимодействовать с командой и внешними партнерами для решения сложных задач!!!!Только ПЕЕРЕЗД в г. Южно-Сахалинск, Сахалинская область!!!НЕ удаленная работа!!! Индивидуальное сопровождение при переезде кандидата и членов его семьи:  Возмещение перелета; Возмещение аренды жилья; Помощь в трудоустройстве супруги/ супруга; Устройство детей в детские сады и школы;  Требования:  Высшее образование в области: математики/ информатики/ физики или смежных дисциплин; Не менее 5 лет в Data Science, включая 3 года на руководящих позициях; Реализация проектов с SOTA-архитектурами (Transformers, GAN, LLM); Опыт работы с MLOps (Docker, Kubernetes, Airflow); Навыки работы с Python и библиотеками: PyTorch, TensorFlow, OpenCV, Scikit-learn, Pandas, NumPy; Опыт работы с базами данных (SQL, NoSQL), облачными платформами (AWS, Azure) и MLOps-практиками; Знание методов обработки данных с БПЛА (геопривязка, ортофотопланы) и временных рядов (ARIMA/SARIMA/SARIMAX, Prophet); Английский язык: на уровне чтения технической документации; Понимание этических аспектов ИИ и работы с персональными данными. Обязанности: Лидерство и управление:  Руководство командой Data Science (до 7 человек), менторство Middle/Junior-специалистов; Участие в подборе персонала, формировании KPI команды и стратегическом планировании проектов.Исследования и разработка: Разработка и внедрение моделей ИИ (CNN, Transformers, GAN, LLM) для задач CV, NLP и временных рядов; Интеграция решений в клиент-серверные архитектуры (опыт Software Engineering); Участие в Kaggle и аналогичных соревнованиях (цель — топ-30%).Проектная деятельность: Трансформация бизнес-задач заказчиков в технические требования; Участие в рабочих группах по регулированию ИИ (GDPR, этические стандарты).Научная деятельность: Публикация статей в журналах Q1-Q2, подача заявок на гранты (РНФ, РФФИ); Представление СЦИИ на конференциях и сотрудничество с вузами/исследовательскими центрами.Условия: Трудоустройство по ТК РФ, полный соц. пакет;  График работы: Пн-Пт;   Ежегодный оплачиваемый отпуск 44 дня;   Оплата проезда в отпуск раз в два года.​​​​​​​​​​​​​;"
