id,name,area,experience,key_skills,description
128519683,Data Scientist (NLP),Москва,От 1 года до 3 лет,,"Находимся в поиске Data Scientist NLP Мы – РТК ИТ, аккредитованная ИТ компания, оказывающая полный комплекс услуг по разработке и внедрению программных решений. Каждый день на наших проектах задействовано 4200+ сотрудников, у нас 70+ направлений разработки различных решений. За 11 лет нашей работы мы успешно реализовали более 60 ИТ-продуктов. Мы создаем передовую платформу, которая позволяет эффективно обучать, тонко настраивать и разворачивать крупномасштабные языковые модели (LLM) и другие NLP-решения. Наша цель — предоставить командам исследователей и бизнес-пользователям инструментарий для работы с современными моделями ИИ в условиях ограниченного доступа к облачным ресурсам. Мы предлагаем: - Удаленную работу с гибким началом рабочего дня- Оформление по ТК РФ в аккредитованной ИТ-компании;- Оклад и годовая премия;- Кафетерий льгот с возможностью выбора категорий (ДМС или компенсация затрат на медицинские услуги, спорт и т.д.). Вам предстоит: - Работа с одним из фреймворков PyTorch/TensorFlow;- Знание основных подходов для предобработки и векторизации текста;- Наличие опыта решения задач NLP для текста (Text Classification, NER, Text Summarization, QA);- Знакомство и понимание основных принципов современных SOTA моделей NLP;- Владение: git, docker, sql и одним из фреймворков для реализации api. Нам важны: - Опыт работы в роли Data scientist от 2 лет;- Работа с одним из фреймворков PyTorch/TensorFlow;- Знание основных подходов для предобработки и векторизации текста;- Наличие опыта решения задач NLP для текста (Text Classification, NER, Text Summarization, QA);- Знакомство и понимание основных принципов современных SOTA моделей NLP;- Владение: git, docker, sql и одним из фреймворков для реализации api. Будет плюсом:- Практический опыт до обучения и работы с open source LLM;- Публикации по NLP;- Собственные проекты по NLP."
128561677,"ML Engineer / Data Scientist (NLP, CV)",Москва,От 3 до 6 лет,,"Цифровые Привычки  – аккредитованная IT-компания, резидент Сколково, топ-5 подрядчиков Сбера. Мы предоставляем услуги IT-консалтинга, заказной разработки, аутсорсинга IT-процессов и развиваем собственные продукты и проекты партнеров.    Наша команда  — это сплоченный коллектив высококвалифицированных профессионалов, способных эффективно решать самые сложные задачи. Нас более 250 человек, распределенных по разным проектам и городам.    Люди  — самый ценный актив.   Наша команда экспертов объединена общими идеями, ценностями и миссией. Мы делаем свою работу лучше каждый день благодаря общим принципам, которые нами движут.   Мы заботимся о благополучии специалистов: создаем комфортные условия труда, ставим амбициозные задачи и даем возможность поменять проект, если он по каким-то причинам перестал устраивать.   Количество наших проектов растет, как растет и наша команда.    Требования:      Опыт ML/NLP/CV от 3 лет.     Опыт внедрения диалоговых систем, чат-ботов, LLM-based решений.     Опыт построения ML pipeline, обучения, валидации и деплоя моделей.     Глубокие знания Python, PyTorch/TensorFlow.     Опыт работы с PDF OCR/Doc Understanding (Tesseract, EasyOCR, LayoutLMv3, Donut).     Знания NLP-моделей: transformers, embeddings, RAG, summarization, classification.     Опыт оптимизации моделей: quantization, distillation, ускорение inference.     Опыт работы с MLFlow, DVC, Airflow.     Уверенная работа с Docker, Linux.     Опыт построения интеграций ML-моделей в продакшн.      Обязанности:      Разработка и обучение моделей NLP и CV.     Создание диалоговых моделей русского языка, интеграция LLM.     Обработка PDF: извлечение структуры, таблиц, текстов, изображений.     Разработка пайплайнов подготовки данных.     Оптимизация моделей для продакшн-нагрузок.     Участие в проектировании системы и выборе алгоритмов.      Плюсом:      Опыт fine-tuning LLM, RLHF, LoRA.     Опыт построения RAG-архитектур.     Обязательно предоставление сопроводительного письма с описанием опыта по направлению."
128540066,Data аналитик,Москва,От 3 до 6 лет,,"LIAN — системный интегратор с фокусом в аналитике и управлении данными. Мы работаем в трех направлениях: 1. Автоматизация управленческой отчетности (BI) в малом и среднем бизнесе. Строим хранилища данных, настраиваем сбор и интеграцию, разрабатываем отчеты и дэшборды. Наш стек в BI включает все современные инструменты, в том числе open-source ПО. 2. Заказная разработка аналитических систем. Когда у нашего клиента есть специфичный запрос, мы разрабатываем аналитические системы с нуля. Часто применяем подходы BigData, Data Science, актуальные подходы к программному анализу данных и прогнозированию. 3. Запуск и ресурсное обеспечение команд разработки в комплексных проектах цифровой трансформации. Мы усиливаем команды наших партнеров и клиентов собственными сотрудниками и обеспечиваем максимально быстрый старт новых проектов. Среди наших заказчиков - крупные системные интеграторы, банки, нефтегазовые, химические производства, логистические компании, стартапы. Сейчас мы приглашаем опытного Data аналитика Чем предстоит заниматься:  Организация и автоматизация процессов оркестрации с Airflow: запуск, мониторинг, алерты, управление зависимостями задач и DAG-ов; Проектирование и оптимизация потоков переноса данных из MSSQL в новое хранилище; Анализ источников данных в легаси MSSQL: сбор информации о содержимом, выявление ключевых бизнес-сущностей и зависимостей, регламентных операций; Обеспечение качества, тестирование данных и контроль их целостности при миграции и трансформации; Разработка и поддержка моделей данных и трансформаций в dbt для формирования конечных витрин; Внедрение и сопровождение процессов инкрементальной загрузки и оптимизация производительности; Работа с потоками данных и интеграция с Kafka для обмена событиями в реальном времени.  Наши пожелания к кандидатам:  Опыт работы аналитиком данных от 5 лет; Опыт работы с Apache Airflow в корпоративной среде: настройка и управление дата-пайплайнами, разработка DAG на Python для автоматизации ETL процессов, оптимизация и мониторинг выполнения DAG; Опыт работы со стеком: ЯП Python, хранилище S3, стриминг Kafka, СУБД Postgres, MSSQL, MongoDB, Clickhouse; Опыт разработки ETL/ELT процессов на основе бизнес-требований с пониманием трансформации и интеграции данных; Знание принципов работы с каталогами данных; Опыт проектирования и создания модели данных, адаптирования для аналитических задач и эффективной работы хранилища; Понимание потоковой обработки данных (Kafka, Spark Streaming): опыт работы с Kafka - настройка, оптимизация и масштабирование обязательны, развертывание желательно; Уверенное использование SQL для сложных запросов и оптимизации производительности (оконные функции, CTE, маппинги между БД); Глубокие знания и опыт работы с реляционными БД: понимание структуры данных, способов наполнения и управления данными; Навыки работы с системами контроля версий (Git).  Желательно:  Опыт работы в финтех; Опыт настройки CI/CD для дата-процессов; Опыт работы с облачными платформами (Yandex.Cloud); Опыт или понимание фондового рынка и инвестиционных инструментов.  Что мы предлагаем:  Форма трудоустройства на ваш выбор: договору оказания услуг с ИП или самозанятым Участие в интересных масштабных проектах с Заказчиками федерального и международного уровня Работа с передовыми технологиями Возможности профессионального и карьерного роста Полностью удаленная работа Регулярная и достойная оплата труда  В нашей команде работают профессионалы с разносторонним опытом. Здесь ты найдешь профессиональные задачи и новые вызовы, сможешь реализовать свой потенциал.Хочешь стать частью нашей команды? Мы ждем твоего отклика и свяжемся с тобой !"
128560195,Senior Data-аналитик/Аналитик данных,Санкт-Петербург,Более 6 лет,"SQL, PostgreSQL, Python, pandas, Clickhouse, Greenplum, А/В тесты, B2C исследования, Switchback, Geo A/B, Matplotlib","Привет! Мы — аккредитованная IT-компания Maxim Technology. Занимаемся разработкой платформы для пассажирских и грузовых поездок. Самый крупный из наших заказчиков — сервис Maxim. Мы первыми начали менять рынок поездок, создав для Maxim цифровую платформу для связи пассажира и водителя раньше Uber и Gett. Сегодня наша команда работает над высоконагруженными сервисами — в сутки платформа обрабатывает более миллиона заказов. Наше ПО — лидер рынка в регионах России, и мы не собираемся останавливаться на достигнутом! Наша команда растёт быстрыми темпами, и сейчас в штате более 450 IT-специалистов. Офисы компании располагаются в Кургане, Челябинске, Тюмени, Набережных Челнах, Казани, Екатеринбурге и Санкт-Петербурге, но у нас можно работать и удалённо. Сейчас мы в поиске опытного Data-аналитика уровня Senior, который будет находить и внедрять решения для роста бизнеса и выстроит систему анализа данных, дизайна и анализа экспериментов в одной конкретной доменной области. Мы ищем самостоятельного специалиста с сильными soft skills, который умеет переводить данные в конкретные бизнес-решения и эффективно презентовать результаты своей работы. Основные задачи:- Проектирование, запуск и анализ A/B-тестов (в т. ч. Switchback, Geo A/B), приоритизация гипотез;- Сегментация и кластеризация пользователей, исследование CJM, поиск точек роста;- Прогнозирование ключевых метрик и их влияния на процессы и бизнес-результаты;- Подготовка понятных аналитических записок и презентаций для стейкхолдеров. Мы ожидаем от будущего коллеги:- Опыт работы Data-аналитиком от 3-х лет в направлении B2C;- Глубокие знания статистики;- Опыт проектирования, проведения и анализа A/B тестов, включая Switchback и Geo A/B, а также опыт работы с платформами A/B тестирования;- Умение формулировать и приоритизировать гипотезы, защищать выводы на уровне C-level;- Продвинутый SQL и опыт работы с ClickHouse / Greenplum;- Python (pandas, matplotlib / seaborn) для EDA и автоматизации;- Навыки data-storytelling и визуализации результатов. Что дальше? У нас простой процесс подбора. Тебя ждёт интервью с тимлидом, и после этого мы выходим с оффером. Отправляй свой отклик! Мы тебя ждём."
128529252,Support Analyst (Data Platform),Москва,От 1 года до 3 лет,,"X5 Group — российская розничная торговая компания, управляющая продуктовыми торговыми сетями «Пятёрочка», «Перекрёсток» и «Чижик», а также цифровыми сервисами «Vprok.ru Перекрёсток», 5Post, «Много Лосося» и медиаплатформой Food.ru. X5 Tech - IT-компания и основной цифровой партнер торговых сетей и бизнесов X5 Group. Команда из более 5000 специалистов разрабатывает решения, которые помогают 372 тысячам сотрудников группы работать с максимальным технологическим комфортом, а миллионам покупателей быстро и удобно покупать свежие продукты. Мы — команда, которая поддерживает процессы доставки и преобразования данных в нашей дата-платформе. Наша задача — обеспечить стабильную и корректную загрузку данных из различных систем источников в единую платформу. Команда разделена на две основные области — первая отвечает за загрузку и хранение данных, вторая — за работу с витринами данных. Эта вакансия открыта в направлении поддержки процесса доставки данных.   В нашей команде тебе предстоит:  Управление сопровождения дата-платформы и отчетности; Обеспечивать бесперебойное функционирование интеграционных потоков на платформе данных в соответствии с установленным регламентом; Выявлять, анализировать и устранять сбои и отказы в работе интеграционных процессов; Оказывать техническую поддержку пользователей платформы данных; Обрабатывать обращения клиентов в соответствии со сценариями обслуживания и установленными стандартами качества; Проводить анализ причин обращений пользователей и сбоев в работе интеграционных потоков.  Мы ждем тебя, если ты:  Имеешь опыт работы в поддержке 2 линии; Знаешь архитектуру и технологии построения платформ данных Data Lake, DWH, Lakehouse; Имеешь опыт работы с реляционными СУБД и SQL движками , таких как Postgress, Greenplum, Hive, Trino; Уверенно владеешь SQL.  Мы предлагаем:  Официальное оформление с белой ЗП, ежеквартальные премии по результатам работы; Удобный офис с бесплатной парковкой на м. «Волгоградский проспект» / МЦД «Калитники» Гибкий график работы (с 8/9/10 утра) / График работы: 5/2, с 9:00 до 18:15 (в пятницу — до 17:00); Возможность работать удалённо или в гибридном формате; Широкий пакет ДМС (включая выезд за рубеж и стоматологию), страхование жизни и здоровья; Возможность учиться и развиваться за счёт компании: внешние тренинги и семинары по профессиональным тематикам, участие в крупнейших конференциях страны, программы развития цифровых и управленческих навыков (Цифровая академия, Школа Тимлидов), онлайн и офлайн мастер-классы, корпоративный университет «X5 Полка», школа наставников и многое другое; Программы мотивации для спикеров и авторов: внутренняя школа Speak Up School, Write Up, ачивки и баллы за выступления, подготовка спикеров к крупнейшим конференциям страны, сообщество авторов на Хабре, возможность шерить опыт с комьюнити внутренних и внешних экспертов; Обмен опытом через cообщества: 12 технических комьюнити от java до devops; Яркая корпоративная жизнь с большим количеством мероприятий, конкурсов и возможностей для творческой реализации: регулярные внутренние митапы, демо-дни, открытые микрофоны, день IT-специалиста, программы волонтерства, корпоративное предпринимательство X5 Idea Challenge.  Присоединяйся к команде X5 Tech, чтобы создавать будущее ритейла вместе с нами!"
