id,name,area,experience,key_skills,description
128123839,"Медицинский аналитик / Data Analyst (офис, м. Мякинино)",Москва,От 1 года до 3 лет,"MS Excel, Python, Анализ данных, SQL, Визуализация данных, Формирование аналитической отчетности, Работа с ЛИС/МИС","ГКУ МО «Центр внедрения изменений Министерства здравоохранения Московской области» — основной проектный офис Министерства здравоохранения Московской области, единый аналитический центр подготовки и принятия решений в рамках национальных проектов в сфере охраны здоровья жителей Подмосковья. Наша миссия — следить за тем, как меняются потребности пациентов, и помогать здравоохранению региона меняться вместе с ними. Мы расширяем нашу команду и ищем Аналитика данных (внутренний грейд - Ведущий аналитик).    Чем предстоит заниматься:  Управление медицинскими информационными системами (МИС/ЛИС); Участие во внедрении, обновлении и модернизации систем ЛИС/МИС в Центре; Обработка и анализ лабораторных данных; Оптимизация лабораторных процессов и методология; Разработка и ведение актуальной документации; Проведение обучения сотрудников Центра работе с ЛИС/МИС.    На что ориентируемся при оценке кандидата:  Оконченное высшее образование по направлениям:""Биоинформатика"", ""Биотехнология"", ""Медицинская биофизика/биохимия"", ""Программная инженерия"", ""Медицинская кибернетика"", ""Информационные системы в здравоохранении; Продвинутый уровень владения MS Excel (сводные таблицы, ВПР, графики диаграммы, формулы и т.д.), знание Python, SQL; Опыт работы с медицинскими информационными системами (ЛИС/МИС) от 1,5 лет; Опыт формирования отчетов и аналитики; Понимание лабораторных процессов и практический навыки работы с лабораторными данными.    Наше предложение:  Официальное трудоустройство c соблюдением всех гарантий ТК РФ; Формат работы: офис; График: 5/2, 9.00-18.00; Адрес: г.Красногорск, бульвар Строителей, 4к1 (м. Мякинино); Возможность участвовать в сложных и интересных проектах; Участие в корпоративных мероприятиях, получение бонусов и скидок для сотрудников."
128106803,Руководитель группы аналитики Data Platform в VK,Москва,Более 6 лет,"SQL, Базы данных, Математическая статистика, DWH, Python","Мы создаём большой Data Lake, собирающий данные всех продуктов внутри VK. Основная цель аналитиков и инженеров Data Platform — собрать DWH с необходимым набором core дата-сетов, которые будут решать любые задачи кросс-продуктового взаимодействия. Задачи  Определять формат работы с метриками в группе VK: формулы, версии, работа с CDO Регулировать работу с управленческими витринами и дашбордами — прозрачное качество и надёжные поставки Проектировать DQ-проверки на критически значимые метрики и отчёты — свежесть, доступность, производительность, мониторинг и алерты Участвовать в построении архитектуры дата-решений и схем взаимодействий с Data Platform Выступать в роли «играющего тренера» для команды, проводить ревью задач, растить компетенции сотрудников команды  Требования  Опыт работы руководителем команды продуктовой аналитики или аналитики DWH в крупной IT-компании от пяти лет Опыт построения SLA, DQ, стандартизации метрик и data governance (каталоги/lineage/версионирование) Сильный SQL, Python (+ базовые библиотеки), опыт в BI Понимание архитектуры или основных принципов построения DWH (предагрегаты, партиционирование и так далее) Системное мышление, умение быстро разбираться в новых системах и процессах Умение применять математическую статистику, теорию вероятностей и базовый матанализ для решения задач бизнеса через данные Способность к критическому мышлению, умение найти суть проблемы и предложить системное решение"
128041383,Data Scientist,Москва,От 1 года до 3 лет,,"Ключевые задачи:  Разработка ML-моделей в розничных рисках (Application, Behavioural, Collection, Antifraud) Поддержание мониторинга по действующим моделям Разработка фичей, поддержание feature store Внедрение разработанных моделей  Что важно для нас:  Опыт работы в финтехе от 2-х лет (стажировки, практика) Оконченное высшее образование Знание языка Python и ML-библиотек Уверенное владение SQL (PostgreSQL, T-SQL) Понимание принципов Feature Engineering (генерация фичей, предобработка, очистка данных) Знание математической статистики и теории вероятности Опыт работы c Big Data Hadoop/Hive и Git  Что предлагаем:  Официальное оформление в соответствии с ТК РФ График работы: 5/2, с 09.00-18.00, пятница сокращенный день до 16:45 (гибридный формат) Конкурентный уровень дохода Доплата к отпуску и больничному листу «Кафетерий льгот»: ДМС для работника и членов семьи, возмещение затрат на отдых, спортивные услуги, покупки на маркетплейсе «ПСБ Маркет» Дополнительные льготы при заключении брака и рождении детей Материальная поддержка в сложных жизненных ситуациях Бесплатная программа поддержки работников: юридические, финансовые и психологические консультации, помощь в бытовых вопросах, автопомощь, корпоративные скидки, профориентация детей работников Возможность профессионального развития и прохождения внутреннего и внешнего профессионального обучения Корпоративная паритетная пенсионная программа"
128016622,Data Scientist в команду Прогноза промо-продаж,Москва,От 1 года до 3 лет,,"X5 — российская розничная торговая компания, управляющая продуктовыми торговыми сетями «Пятёрочка», «Перекрёсток» и «Чижик», а также цифровыми сервисами «Vprok.ru Перекрёсток», 5Post, «Много Лосося» и медиаплатформой Food. X5 Tech - IT-компания и основной цифровой партнер торговых сетей и бизнесов X5 Group. Команда из более 5000 специалистов разрабатывает решения, которые помогают 372 тысячам сотрудников группы работать с максимальным технологическим комфортом, а миллионам покупателей быстро и удобно покупать свежие продукты. Мы ищем Data Scientist в команду прогнозирования спроса Наша цель - точно предсказывать будущие продажи для десятков тысяч товаров в тысячах магазинов. Мы строим модели, которые помогают оптимизировать запасы, планировать закупки и управлять промоакциями, чтобы бизнес принимал решения на основе данных, а не интуиции. Основная задача:  Разрабатывать и улучшать модели прогнозирования спроса, учитывающие сезонность, акции, цены, погоду и поведение покупателей.  Мы используем как классические ML-алгоритмы (LightGBM, CatBoost), так и нейросетевые подходы (Temporal Fusion Transformer, LSTM). Вся модельная цепочка - от сырых данных до продакшн-прогнозов - построена внутри нашей команды.   Чем предстоит заниматься:  Участвовать в разработке моделей для продуктивной среды Строить модели машинного обучения, улучшать качество прогноза Заниматься аналитикой и проверкой гипотез Развивать инструменты для проведения A/B тестов Писать код, проводить code-review Предлагать способы оптимизации и совершенствования существующих инструментов  Что ждем от кандидата:  Знание Python (Scala/Java могут оказаться плюсом) Знание классических алгоритмов и структур данных Знание теоретических и практических продвинутых методов машинного обучения Знание SQL, знакомство с hadoop-стэком (кандидаты уровня middle должны понимать, как выглядит план запросов и что происходит ""под капотом"") A/B тесты, генерация и проверка гипотез (будет плюсом опыт с variance reduction, CUPED, линеаризацией и методом бакетов) Опыт работы с (docker, kubernetes, pyspark, kafka, postgres, airflow) Наличие опыта вывода разработанных решений в прод.  Мы предлагаем:  Официальное оформление с белой ЗП, ежеквартальные премии по результатам работы; Удобный офис рядом с м. «Добрынинская» / удобный офис с бесплатной парковкой на м. «Волгоградский проспект» / МЦД «Калитники» Гибкий график работы (с 8/9/10 утра) / График работы: 5/2, с 9:00 до 18:15 (в пятницу — до 17:00); возможность работать удалённо или в гибридном формате; Широкий пакет ДМС (включая выезд за рубеж и стоматологию), страхование жизни и здоровья; Возможность учиться и развиваться за счёт компании: внешние тренинги и семинары по профессиональным тематикам, участие в крупнейших конференциях страны, программы развития цифровых и управленческих навыков (Цифровая академия, Школа Тимлидов), онлайн и офлайн мастер-классы, корпоративный университет «X5 Полка», школа наставников и многое другое; Программы мотивации для спикеров и авторов: внутренняя школа Speak Up School, Write Up, ачивки и баллы за выступления, подготовка спикеров к крупнейшим конференциям страны, сообщество авторов на Хабре, возможность шерить опыт с комьюнити внутренних и внешних экспертов; Обмен опытом через cообщества: 12 технических комьюнити от java до devops; Яркая корпоративная жизнь с большим количеством мероприятий, конкурсов и возможностей для творческой реализации: регулярные внутренние митапы, демо-дни, открытые микрофоны, день IT-специалиста, программы волонтерства, корпоративное предпринимательство X5 Idea Challenge;    Присоединяйся к команде X5 Tech, чтобы создавать будущее ритейла вместе с нами!"
128036285,Data scientist (автоматический анализа текстовых документов),Москва,От 1 года до 3 лет,,"Обязанности:Основное направление работы Центра Автоматизации в Альфа-банке - создание инструментов и технологий для автоматизации разработки моделей.Что предстоит делать на этой позиции?В первую очередь, тебе предстоит развивать внутреннюю систему для автоматического анализа текстовых документов с применением больших языковых моделей (LLM):• разрабатывать и внедрять новые сценарии анализа текстов (под новые типы документов)• улучшать стабильность и качество текущих сценариев анализа текстов, оптимизировать код• применять LLM для успешного решения кейсов (писать промпты, разбираться в тонкостях работы с LLM, разрабатывать RAG-пайплайны)• совместно с командами DE, MLOps, мониторинга интегрировать сервисы в промышленную средуТребования:• промышленный опыт разработки и внедрения моделей и аналитических• алгоритмов в продакшн, в том числе на основе LLM• умение писать качественный и эффективный код на Python• знание классического ML и алгоритмов• опыт применения и понимание работы LLM, желание развиваться в этом направлении• уверенное владение ML-стеком Python: lightgbm/xgboost/catboost, Scikit-Learn, Pandas, Numpy• умение работать с инструментами Spark, Hadoop, HiveБудет большим плюсом:• опыт в области обработки естественного языка, понимаете принципов работы NLP моделей• контрибьют в ML-библиотеки• опыт full-stack разработки• знание DL-алгоритмов и опыт работы с PytorchУсловия:• Стабильную работу в одном из крупнейших банков страны• Сильное DS community, большое разнообразие рабочих и внерабочих активностей.• Конкурентную заработную плату, соцпакет.• Условия для роста и развития (в т.ч. конференции, тренинги, внутренние программы развития).• Дружный коллектив единомышленников (все специалисты, занимающиеся машинным обучением объединены одним департаментом для максимально плотного и продуктивного обмена знаниями).• Передовой стек технологий, высокопроизводительное оборудование.• Возможность решать разнообразные прикладные задачи с выводом в промышленную эксплуатацию, возможность существенно влиять на результат (в т.ч. в бизнес-смысле) и способы его достижения (вплоть до внесения изменений в архитектуру).• Квартальный бонус по результатам работы;• ДМС, страхование жизни;• корпоративное обучение;"
127978736,Data Scientist Middle/Middle+,Москва,От 1 года до 3 лет,,"Обязанности:  Разрабатывать, внедрять и оптимизировать классические ML‑модели (регрессия, классификация, ансамбли и др.); Подготавливать и обрабатывать данные, строить пайплайны для обучения и тестирования; Интегрировать модели в существующую инфраструктуру; Оптимизировать производительность и масштабируемость решений. Требования:  • Уверенное владение Python для промышленной разработки; Опыт работы с PySpark SQL для обработки больших данных; Глубокие знания классических методов машинного обучения; Понимание принципов построения производственных ML-систем (MLOps-практики, работа с пайплайнами); Опыт работы с реляционными базами данных и написания SQL-запросов; Опыт в области NLP (предобработка текстов, vectorization, классификация екстов, topic modeling) желателен; Базовые знания и практический опыт применения методов deep learning (TensorFlow, PyTorch); Навыки оптимизации вычислительных нагрузок; Умение работать в команде и взаимодействовать с аналитиками, инженерами данных и продакт-менеджерами; Системное мышление, внимание к деталям, умение предлагать практичные решения. Условия:  Стабильную работу в одном из крупнейших банков страны Сильное DS community, большое разнообразие рабочих и внерабочих активностей. telegram: @aaanalytics; Конкурентную заработную плату, соцпакет; Условия для роста и развития (в т.ч. конференции, тренинги, внутренние программы развития); Дружный коллектив единомышленников (все специалисты, занимающиеся машинным обучением объединены одним департаментом для максимально плотного и продуктивного обмена знаниями); Передовой стек технологий, высокопроизводительное оборудование. Возможность решать разнообразные прикладные задачи с выводом в промышленную эксплуатацию, возможность существенно влиять на результат (в т.ч. в бизнес-смысле) и способы его достижения (вплоть до внесения изменений в архитектуру); Квартальный бонус по результатам работы; ДМС, страхование жизни; Корпоративное обучение."
